Country,City,Company Name,Address,Phone,Website,Email
ukraine,odessa,MARINE-TRANS LTD.,"Street Zhukovskogo 2, Odessa, Ukraine",+380675177206,www.marine-trans.com.ua,marketing@marine-trans.com.ua
ukraine,odessa,"LOGIS GROUP, MULTIMODAL SERVICES","Ukraine, Odessa ,  Office 202, 5 Solnechnaya str.,",+380482321213,www.logisgroup.net,v.ognevoy@logisgroup.net
ukraine,odessa,OLENICH GROUP LTD.,"65012, Odessa, Ukraine, 8, Otradnaya street, app. 2.",+38 (0482) 37-1433,www.og.ua,welcome@og.ua
ukraine,odessa,ARENA MARINE LTD,"Deribasovskaya 14, office 401, Odessa, Ukraine",+380 48 786 0646,arenamarine.com/,forwarding@arenamarine.com
ukraine,odessa,ADM LOGISTIC,"Ukraine, Odessa region, Ivanovka, Lenina street",+380487363936,www.adm-logistic.com.ua,alex@adm-logistic.com.ua
ukraine,odessa,ODESSA PORT CARGO TRANSHIPMENT COMPLEX LTD,"Primorskaya 40 Street, Odessa - Ukraine",+380482377182,www.oppk.com.ua,office@oppk.od.ua
ukraine,odessa,HEADLINERS SHIPPING & TRANSPORT,"Uspenskaya Ul 25/7, Odessa, Ukraine",+380 48 737-46-77,www.headliners.com.ua,info@headliners.com.ua
ukraine,odessa,UKREXIMTRANS,"45 Triotskaya Str, Off 10, 65045 Odessa, Ukraine",+380 48 728-90-40,www.uet.com.ua,freight003@uet.com.ua
ukraine,odessa,UKREXPORTER,"Yamchitskogo St. Office 1, 65000 Odessa, Ukraine",+380 67 763-04-20,www.ukrexporter.com,info@ukrexporter.com
ukraine,odessa,CMT LTD,"21 Uspenskaya Str, 65014 Odessa, Ukraine",+380 48 730-99-04,www.cmtltd.com.ua,wca-ukraine@cmtltd.com.ua
ukraine,odessa,DAMCO,"Grecheskaya Str 17, 6th Floor, 65026 Odessa, Ukraine",+380 48 738-50-86,www.damco.com,mariya.khilya@damco.com
ukraine,odessa,DUKE ACTIVE LTD,"Shevchenko Line, 4D of 65, 65044 Odessa, Ukraine",+380 48 235-60-57,www.duke-active.com,olga@duke-active.com
ukraine,odessa,EURANS LTD,"9-a Seminarskaya Str, 65044 Odessa, Ukraine",+380 482 34-41-29,www.eurans.com.ua,info@eurans.com.ua
ukraine,odessa,CARGO-PARTNER LLC,"3 Sadovaya Street, UA-65003 Odessa, Ukraine",+380 48 778-67-24,www.cargo-partner.com,ods@cargo-partner.com
ukraine,odessa,NORTROP LTD,"15 Tenistaya Str, Office 55, 65009 Odessa, Ukraine",+380 48 714-93-17,www.nortrop.com.ua,nortropod@nortrop.com.ua
ukraine,odessa,ODEMARA-INTER,"Office 203, 1a Tamozhennaya Square, 65026 Odessa, Ukraine",+380 48 729-33-85,www.odemara.com,forwarding@odemara.com
ukraine,odessa,PLASKE JSC,"15 Velyka Arnautska Str, 65012 Odessa, Ukraine",+380 48 728-72-20,www.plaske.ua,odessa@plaske.ua
ukraine,odessa,ROKADA LOGISTICS,"Chernomorskogo Kazachestva 66/2, Odessa, Ukraine",+380 48 734-04-11,www.rokada.com.ua,
ukraine,odessa,TREXIM LTD,"23 Primorskaya Str, App 20, 65026 Odessa, Ukraine",+380 48 734-20-01,www.trexim.com.ua,office@trexim.com.ua
ukraine,odessa,TST FORWARDING,"Arnautskaya 2a, 304, 65125 Odessa, Ukraine",+380 96 289-02-25,www.tst-odessa.com.ua,sales@tst-odessa.com.ua
ukraine,odessa,INTERNATIONAL CARGO SERVICE HD,"20 Bunina Str, Off 19, 65000 Odessa, Ukraine",+380 48 234-48-53,www.hdlogistic.com,maximt@hdlogistic.com
ukraine,odessa,ALPHACOSTA UKRAINE LLC.,"App. 5, 4 Kanatnaya Street, Odessa 65014, Ukraine",+38 (048) 7405974,www.alphacosta.com,mgmt@alphacosta.com
ukraine,odessa,AMA FREIGHT LOGISTIC (UKRAINE) LTD.,"Polskij Spusk, 6, Odessa 65026, Ukraine",+380 482 328125,www.amafreight.com,ama-freight-odessa@eurocom.od.ua
ukraine,odessa,BLACK SEA LINK LTD.,"Office 505, Business Center Prestizh, 84, Balkovskaya str., Odessa, Ukraine",+38(0)48 734 0731,www.bslink.net,master@bslink.net
ukraine,odessa,ES TRANS GROUP 928 LTD,"Bolshay Arnautsakay Str. 69/101, Odessa, Ukraine",+3804 8729 5928,www.estgroup928.com,info@estgroup928.com
ukraine,odessa,JSC MITRIDAT ODESSA,"6, Primorskaya str.,  65029, Ukraine",+38 (048) 7729-39-34,www.mitridat.odessa.ua,sales@mitridat.odessa.ua
ukraine,odessa,LIMCO LOGISTICS LLC,"10 Bunina Str. Off. 3, Odessa 65026, Ukraine",+380 48 740-55-65,www.limcologistics.com,info@limcologistics.com.ua
ukraine,vinnista,APEX TRANS LTD,"Kvyateka Str 5, Office 49, Vinnista, Ukraine",+380 432 46-88-25,www.apextrans.net,info@apextrans.net
ukraine,zaporizhzhya,DELTA EXPRESS,"64D Patrioticheskaya Str, Office 10, 69005 Zaporozhye, Ukraine",+380 61 225-68-00,www.dexi.biz,airchart@dexi.biz
un.-arab-emirates,abu dhabi,AL SAHAL SHIPPING & CLEARING LLC.,"Salam Street, Near LULU centre, Burjeel LaundryM-03, Abu Dhabi, UAE",+971 (0)2672 4133,alsahalgroup.com,sajina@alsahalgroup.com
un.-arab-emirates,abu dhabi,DELIGHT INTERNATIONAL MOVERS,"Musaffah Ind. Area 13, Plot 6, Abu Dhabi, UAE 51634",+97126902900,www.delightmovers.com,professionalpackersandmove@gmail.com
un.-arab-emirates,abu dhabi,HSR INTERNATIONAL FREIGHT,"PO BOX 5456, Abu Dhabi, United Arab Emirates",+97126799111,www.hsrfreight.com,contactus@hsrfreight.com
un.-arab-emirates,abu dhabi,EAGLE SHIPPING LLC,"Office no 104 ,Deewan building, tca, Abu Dhabi, United Arab Emirates",+971 26799550,www.eagleshippingllc.com,service@eagleshippingllc.com
un.-arab-emirates,abu dhabi,BWL - BLUESTAR WORLDWIDE LOGISTICS,"Office # 601. 6th floor, Abdulla building, Salam and Hamdan Street Junction. Near to Al Masraf ...",+971 2 4413815,www.bluestarlogistics.org/,prasanna@bluestarlogistics.org
un.-arab-emirates,abu dhabi,SNTTA CARGO,"Al Falahi Building, Opp Navy Gate, Passport Road, Abu Dhabi, Un. Arab Emirates",+971 2 644 7715,www.snttacargo.com,hussein@snttacargo.com
un.-arab-emirates,abu dhabi,DGL CLEARING AND FORWARDING,"Flat 2 Mezzanine Floor, New Age Company Building, Abu Dhabi, Un. Arab Emirates",+971 2 671 5331,www.dglme.com,wca@dglme.com
un.-arab-emirates,abu dhabi,AL KUNAIBY SHIPPING AGENCIES (MALTRANS),"PO Box 4143, Abu Dhabi, Un. Arab Emirates",+971 2 632 6395,www.maltrans.net,m.hirzallah@maltranscargo.com
un.-arab-emirates,abu dhabi,LOGIQUEST LOGISTICS LLC,"Office Mezz 3, Delma Street, Opp Sh Zayed University, Abu Dhabi, Un. Arab Emirates",+971 2 658 7668,www.logiquestllc.com,shabin.s@logiquestllc.com
un.-arab-emirates,abu dhabi,PEERAJ CLEARING & FORWARDING CO LLC,"PO Box 7370, Abu Dhabi, Un. Arab Emirates",+971 2 644 5577,www.peeraj.com,peerajad@emirates.net.ae
un.-arab-emirates,abu dhabi,TENESSEE CARGO SERVICES LLC,"PO Box 112426 AUH, Abu Dhabi, Un. Arab Emirates",+971 2 679 9224,www.tenessee.ae,mohd@tenessee.ae
un.-arab-emirates,abu dhabi,BARLOWORLD LOGISTICS LLC,"C6 Tower Bainunah St 34, Al Bateen, Abu Dhabi, Un. Arab Emirates",+971 2 406 9822,www.barloworld-logistics.com,jiyer@bwlog.ae
un.-arab-emirates,abu dhabi,CENTURY EXPRESS FREIGHT SERVICES,"Opp Main Bus Terminal, Beside Red Crescent Society, Abu Dhabi, Un. Arab Emirates",+971 2 441 0441,www.centuryxpress.com,shoukath@centuryxpress.com
un.-arab-emirates,abu dhabi,WILHELMSEN SHIPS SERVICE,"Barwil Abu Dhabi Ruwais LLC, Plot No 77 A, Sector Mina Free Port, Abu Dhabi, Un. Arab Emirates",+971 2 673 3229,www.wilhelmsen.com,ravish.pallavoor@wilhelmsen.com
un.-arab-emirates,abu dhabi,THE KANOO GROUP,"PO Box 245, Abu Dhabi, Un. Arab Emirates",+971 2 677 4444,www.kanoogroup.com,adminauh@kanoo.ae
un.-arab-emirates,abu dhabi,GLOBAL LOGISTICS SOLUTIONS,"Plot No 95, Sector M40, Mussafah, Abu Dhabi, Un. Arab Emirates",+971 2 551 3627,www.glsuae.com,sales@glsuae.com
un.-arab-emirates,abu dhabi,ABU DHABI SHIPPING AGENCY (ADSA),"PO Box 46103, Off Salam Street, Abu Dhabi, Un. Arab Emirates",+971 2 644 9100,www.adsa.ae,adsaauh@emirates.net.ae
un.-arab-emirates,abu dhabi,CONCORDE EXPRESS CARGO,"Al Falah Street, Jumbu Electronics Building, M Floor No3,  34488, Un. Arab Emirates",+971 2 642 5520,www.concorde.ae,info@concorde.ae
un.-arab-emirates,abu dhabi,DHABIAN INTERNATIONAL FREIGHT,"PO Box 25623,  25623, Un. Arab Emirates",+971 2 446 2977,www.dhabian.com,info@dhabian.com
un.-arab-emirates,abu dhabi,INTERNATIONAL MARITIME LLC,"1603 National Bank of Abu Dhabi Building, Salam St, Abu Dhabi, Un. Arab Emirates",+971 2 645 6701,www.imadxb.com,savio@imaauh.com
un.-arab-emirates,abu dhabi,KHALIDIA INTERNATIONAL SHIPPING LLC,"Blocks A&B, Garden Tower, Mezzanine Floor, Khalifa Street, Abu Dhabi, Un. Arab Emirates",+971 2 659 2000,www.khalidiashipping.com,kship@emirates.net.ae
un.-arab-emirates,abu dhabi,LDS LOGISTIC DISTRIBUTION SYSTEMS LLC,"PO Box 128368, Abu Dhabi, Un. Arab Emirates",+971 2 641 8071,www.ldsdubai.com,
un.-arab-emirates,abu dhabi,ALLIGATOR SHIPPING CO LLC,"Mezanaine Flr, Awad Al Otaiba Tower, Electra Street, Abu Dhabi, Un. Arab Emirates",+971 2 643 2841,www.ascouae.com,asco@ascouae.com
un.-arab-emirates,abu dhabi,KUEHNE + NAGEL LLC,"Al Faraa Tower, Al Falah Street, 2nd Floor, Flat #203,  29462, Un. Arab Emirates",+971 2 678 8770,www.kn-portal.com,info.abudhabi@kuehne-nagel.com
un.-arab-emirates,abu dhabi,AL SALAM EXPRESS CARGO,"5th Floor, Flat 509, Al Youssef Centre Building, Hamdan Street, Abu Dhabi, Un. Arab Emirates",+971 2 626 0510,www.alsalamcargo.com,asecadem@emirates.net.ae
un.-arab-emirates,abu dhabi,CLARION FREIGHT INTERNATIONAL,"PO Box 27557, Abu Dhabi, Un. Arab Emirates",+971 2 676 6520,www.clarionshipping.com,clarion@emirates.net.ae
un.-arab-emirates,abu dhabi,KANOO FREIGHT,"P.O.Box:245, Abu Dhabi, Un. Arab Emirates",+971 2 6954206,www.kanoofreight.com,cargosales@kanoo.ae
un.-arab-emirates,abu dhabi,PLATINIUM SHIPPING & LOGISTICS,"Khaleefa Street, P. O. Box: 3820, Abu Dubai, Un. Arab Emirates",+971 2-6795253,www.platinum-shipping.com,info@platinum-shipping.com
un.-arab-emirates,abu dhabi,WEST OCEANIC SHIPPING AGENCIES LOLC.,"Shed no 16, Mina Zayed Port, Un. Arab Emirates",+971 2 6734047,www.westosa.com,info@westosa.com
un.-arab-emirates,ajman,SEA SHORE LOGISTICS - SSL INTERNATIONAL FZC,"E-117, E1, Ajman Free Zone Building, Ajman, United Arab Emirates",+971 6525 5996,www.ssluae.org/,umair@ssluae.org
un.-arab-emirates,ajman,MULTI TRANS SHIPPING & LOGISTICS,"Off. 3019-E Amberjem Tower, Ajman Free Zone, Ajman, UAE",+971 552520498,www.mtsluae.com,ekram@mtsluae.com
un.-arab-emirates,ajman,SABELATRANS SHIPPING GLOBAL FZE,"Suite D-13, Ajman Free Zone - UAE",+971 (0)67457906,www.sabelatrans.com,ssgchart@eim.ae
un.-arab-emirates,ajman,PROJECT ARABIA SHIPPING SERVICES LLC,"Marina 2 Suite 1003, 10th Floor, Ajman Corniche Road, Ajman, Un. Arab Emirates",+971 6 744 7845,www.projectarabia.com,projarab@eim.ae
un.-arab-emirates,al quoz,PLATINIUM SHIPPING & LOGISTICS,"Near Jotun Paint, OPP. IAL container yard, Al Quoz Industrial Area, Un. Arab Emirates",+971 4-338 5130,www.platinum-shipping.com,info@platinum-shipping.com
un.-arab-emirates,bur dubai,AL QABANDI & PARTNERS CO L.L.C.,"Office No.: 603 Bank Street Building, Bur Dubai, Dubai, United Arab Emirates",04-3526199,www.qabandi.com,infouae@qabandi.com
un.-arab-emirates,bur dubai,TRICO INTERNATIONAL,"Al Raffa Area, Al Nabooda Bldg, Ground Floor, Bur Dubai, Un. Arab Emirates",+971 4 393 3030,www.tricoglobal.com,frico01@emirates.net.ae
un.-arab-emirates,bur dubai,TOPMOST SHIPPING LLC,"Suite #106 First Floor, Binthani Building, Umm Hurair, Bur Dubai, Un. Arab Emirates",+971 4 397 5888,www.topmostgroup.com,gururaj@topmostgroup.com
un.-arab-emirates,bur dubai,SERVOTECH SHIPPING AND LOGISTICS LLC,"204, 2nd Floor, Al Waleed Building, Rolla Street, Bur Dubai, Un. Arab Emirates",+971 50 7277 1169,www.servotechshipping.com,wca@servotechshipping.com
un.-arab-emirates,bur dubai,RELIANCE FREIGHT SYSTEMS,"M4-Al Murooj Plaza, Adj Capital Residence, Khalid Bin Walid Road, Bur Dubai, Un. Arab Emirates",+971 4 393 8118,www.reliancefreightsystems.com,reliance@emirates.net.ae
un.-arab-emirates,bur dubai,MALTRANS EMIRATES,"Room 401, 4th Floor, Shaikha Lateefa Building, Al Fahidi Street, Bur Dubai, Un. Arab Emirates",+971 4 353 3233,www.agsg.ae,maltrans@agsg.ae
un.-arab-emirates,bur dubai,INTERWORLD SHIPPING AGENCY LLC,"The Business Center, Unit 604, 6th Floor, Khalid Bin Walid Street, Bur Dubai, Un. Arab Emirates",+971 4 396 1111,www.permalogistics.com,dxb@permalogistics.com
un.-arab-emirates,bur dubai,HAKTRANS GLOBAL LOGISTICS LLC,"M - 01 Mina House, Opp Port & Customs Bldg, Adj Sea View Hotel, Bur Dubai, Un. Arab Emirates",+971 4 359 5139,www.haktrans.com,haktrans@emirates.net.ae
un.-arab-emirates,bur dubai,DCFC SHIPPING & FORWARDING SERVICES,"Office No 114 Al Khaleej Centre, Bur Dubai, Un. Arab Emirates",+971 4 282 8512,www.dcfcshipping.ae,dcfcdubi@emirates.net.ae
un.-arab-emirates,bur dubai,AGL LOGISTICS,"PO Box 44723,  Dubai, Un. Arab Emirates",+971 4 359 9560,www.aglfreight.com,augustine@aglfreight.com
un.-arab-emirates,bur dubai,ACTCO GULF FREIGHT LLC,"Al Fahedi Street, Mohebi Centre Building, Third Floor No 6, Bur Dubai, Un. Arab Emirates",+971 4 353 3992,www.afghancontainers.com,actcolkr@emirates.net.ae
un.-arab-emirates,bur dubai,AUSTIN SHIPPING AGENCY LLC,"Office #314, Al Khaleej Centre, Bur Dubai, Un. Arab Emirates",+971 4 359 4440,www.austingroup-me.com,info@austingroup-me.com
un.-arab-emirates,bur dubai,MUSEUM CARGO,"Shop No 6, Souk Al Kabeer, Near Bur Dubai Bus Station,  Dubai, Un. Arab Emirates",+971 4 393 9949,www.museumcargo.com,shamazak@hotmail.com
un.-arab-emirates,deira,BEST MOVER,"Main Naif Road Deira, Dubai - 99543 United Arab Emirates",+971 55 8683 123,www.bestmover.ae/,bethak1233@gmail.com
un.-arab-emirates,deira,SUPER HAYS MARINE SHIPPING SERVICES LL,"Al Nokhitha Buildingm, Hamriya Port, Custon Building, Deira, Dubai, United Kingdom of Arabia",+971 4886 8901,superhays.com,forwarding@superhays.com
un.-arab-emirates,deira,SUPER BUDGET MOVERS AND PACKERS,"10 B Street, Near Marcopolo Hotel, Al Muteena, Deira, Dubai, United Arab Emirates",+971 50 244 0083,www.superbudgetmovers.ae,harryjacob2541@gmail.com
un.-arab-emirates,deira,AL WARQA SHIPPING SERVICES LLC,"#201 Hussain Nasser Ahmed Lootah Bldg., Deira, Dubai, 381201 United Arab Emirates",+97 1 4221 7874,www.alwarqashipping.com/,alwarqashipping@gmail.com
un.-arab-emirates,deira,BURHANI OASIS ENTERPRISE LLC,"Gems Gym Bldg, 2nd Floor, Baniyas Square,  208, Un. Arab Emirates",+971 4 234 7956,www.burhanioasis.com,burhania@eim.ae
un.-arab-emirates,deira,ZUHAL SHIPPING & LOGISTICS LLC,"211, 2nd Floor, Al Yasmin Building, Salahuddin Road, Horalanz, Deira, Un. Arab Emirates",+971 4 262 3075,www.zuhalshipping.com,zuhal@eim.ae
un.-arab-emirates,deira,UN CARGO & LOGISTICS LLC,"Al Khabaisi Area, 128-108,  Dubai, Un. Arab Emirates",+971 4 266 8734,www.uncargo.com,info@uncargo.com
un.-arab-emirates,deira,GIFCO - GHORAYEB INTL. FREIGHT FORWARDING CO,"Al Etihad Bldg 7th Floor, off #706, Opp Sofitel City center residence, City center, Deira, Un. Arab Emirates",+971 4 295 7257,www.ghorayebshipping.com,dubai@gifco.ae
un.-arab-emirates,deira,JENAE LOGISTICS LLC,"PO Box 41475, Frij Al Murar,  Duabi, Un. Arab Emirates",+971 4 238 6001,www.jenaelogistics.com,info@jenaelogistics.com
un.-arab-emirates,deira,MANSOURI INTERNATIONAL TRADING LLC,"210/B, 2nd Floor, Twin Tower,  40970, Un. Arab Emirates",+971 4 228 8543,www.mitllc.net,mitllc@emirates.net.ae
un.-arab-emirates,deira,FAST TRACK EXPRESS LOGISTICS LLC,"Opp Diplomat Hotel,  22534, Un. Arab Emirates",+971 4 273 4757,www.fasttrackdubai.com,ftel@eim.ae
un.-arab-emirates,deira,EXPRESS LINE SHIPPING LLC,"406 Dubai Pearl Building, Nasser Square, Deira, Un. Arab Emirates",+971 4 228 0984,www.expresslineuae.com,info@expresslineuae.com
un.-arab-emirates,deira,AFRICAN SALIHIYA CARGO & CLEARING,"Behind Sabkha Bus Stand, 1st Floor, No 109, Deira, Un. Arab Emirates",+971 4 235 0577,www.africansalihiya.com,afrisali@eim.ae
un.-arab-emirates,deira,HORIZON STAR SHIPPING LLC,"Office 103, Bldg. No 117-516,  Dubai, Un. Arab Emirates",+971 4 2730420,www.hss-co.com,info@hss-co.com
un.-arab-emirates,dubai,DARK BLUE SHIPPING LLC,"1401 14th Floor Latifa Tower, Sheikh Zayed Road, Dubai, United Arab Emirates",+971 4 398 3490,www.darkblueshipping.com/,sales1-dxb@darkblueshipping.com
un.-arab-emirates,dubai,MEPL INTERNATIONAL LLC,"206, Pyramid Centre, Bur Dubai, Dubai, United Arab Emirates (UAE)",+971-4-3965788,www.mepl-intl.com,awais.ganatra@mepl-intl.com
un.-arab-emirates,dubai,GCC CARGO SERVICE LLC,"Al Khabeesi, Street 22 A St, Port Saeed Building, Office 101, Makani , Dubai, UAE",+97142616244,www.gcc-cargo.com,faisal@gcc-cargo.com
un.-arab-emirates,dubai,ROYAL CARGO LLC,"Shed No. 5, Al Hathboor Building, Dubai Airport Road, Dubai, U.A.E. United Arab Emirates",+971 4 2833003,www.rc.ae,m.bari@rc.ae
un.-arab-emirates,dubai,ASV SHIPPING LLC.,"B-18 SoukAl Khonji, Nr Astoria Hotel, Bur Dubai, Dubai, United Arab Emirate",+971 (0)4354 0060,asvsl.com,info@asvsl.com
un.-arab-emirates,dubai,BRIGHTLINK CARGO AND MOVERS LLC.,"Al Asayel Street, Business Bay, Dubai, United Arab Emirates",+971 5 8134 4800,www.brightlinkcargo.com,brightlinkc@gmail.com
un.-arab-emirates,dubai,AFRICAN SHIPPING LINE - ASLINE,"Al Fardha, Dubai Customs Customer Service - Dubai, UAE",+971 56 953 8569,www.africanshippingline.com,asline@africanshippingline.ae
un.-arab-emirates,dubai,UPL LOGISTICS - UNIVERSAL POSTAL LOGISTICS -,"Off. 327, 4WA Building, DAFZA, Dubai, United Arab Emirates",+971 5 6389 3729,upl-logistics.com,m.hassan@upl-logistics.com
un.-arab-emirates,dubai,MOVERS AND PACKERS IN DUBAI,"Deira, Dubai, United Arab Emirates",+971 (0)31 7193 5231,www.packersmoversdubai.com,newpackers2020@gmail.com
un.-arab-emirates,dubai,SAFA MOVERS,"Dubai, United Arab Emirates (UAE)",+971 50 976 5166,www.safamovers.com,info@safamovers.com
un.-arab-emirates,dubai,PAKISTAN CARGO,"Deira, UAE",+971 (055)127 6412,www.thepakistancargo.com,galaxystarcup@gmail.com
un.-arab-emirates,dubai,LORDS EXPRESS SHIPPING SERVICES LLC.,"No. 128 C, corridor 10, Hamsah A building, Mezzanine Floor, Karama, Dubai, UAE",+971 2898298,lordsexpress.com/,bdm@lordsexpress.com
un.-arab-emirates,dubai,BBC CARGO SERVICES LLC.,Al Qusais Industrial Area 3 - Dubai - UAE,+971 5 5913 0642,www.bbccargo.ae,victor@bbccargo.ae
un.-arab-emirates,dubai,RED PEARL LOGISTICS LLC,"Office-706, Mohammed Noor Talib Building, Khalid Bin Al Waleed Road, Dubai, UAE",+971 04-358 5213,www.redpearllogistics.com/,info@redpearllogistics.com
un.-arab-emirates,dubai,QAFILA FZ LLC.,"In 5 Tech, Dubai Internet City, Dubai, United Arab Emirates",+971 4 523 3933,www.qafila.com/,meer.hamza@qafila.com
un.-arab-emirates,dubai,ARDIAN GLOBAL EXPRESS LLC. - AGL,"27 10b Street, Al Khabisi Area, Deira, Dubai, United Arab Emirates",+971 (0)4 397 1226,www.aglexpresscargo.com,sales@aglexpresscargo.com
un.-arab-emirates,dubai,ABC CARGO & COURIER LLC.,"Opposite Al Quoz Mall, Al Quoz, Dubai, United Arab Emirates",+971 056 539 5358,abccargo.ae/,abccargoonline@gmail.com
un.-arab-emirates,dubai,ARZ MOVERS LLC.,10b Al Mateena Street  Dubai  United Arab Emirates,+971 042974100,www.moversdubai.ae,arzmovers@gmail.com
un.-arab-emirates,dubai,GLOBAL NAVIGATION L.L.C.,"314, Business Venue, Ume Hurair Road, Oud Metha, 126095, Dubai, UAE.",+971 (0)4 357 1990,gnlgroup.net/,sales@ae.gnline.co
un.-arab-emirates,dubai,DOYNES LOGISTICS,"Emirates Sky Cargo Building, Cargo Village, Dubai, UAE",+971 55 333 0662,doyenslogistics.com/,ops@doyenslogistics.com
un.-arab-emirates,dubai,FLEX SOLUTIONS FOR SHIPPING AND LOGISTICS L. L. C....,Al Garhoud Street,+971 4 3430040,flex4logistics.com/,ahmed@flex4logistics.com
un.-arab-emirates,dubai,AAC CARGO LLC,"Nahli Bldg., Mezzanine Floor, Office M 5, Abu Hail, Dubai, United Arab Emirates",+971 (0)4 88 80 718,www.aaccargo.com,admin@aaccargo.com
un.-arab-emirates,dubai,SBC MOVERS AND PACKERS,Sultan Bin Zayed the First St - Abu Dhabi - United Arab Emirates,+971 5 0354 3944,www.uaemoverspackers.com/,shelendrasheoran123@gmail.com
un.-arab-emirates,dubai,BRIDGEWAY SHIPPING & CLEARING SERVICES LLC. (BSCS)...,"Jebel Ali,  South Zone, JAFZA, UAE",+971(4) 886 1170,www.bridgewayshipping.com/,deepak@bridgewayshipping.com
un.-arab-emirates,dubai,MASA LOGISTICS FZCO,"Unit 214, W1 - Dubai Airport Freezone - Dubai, UAE",+971 4299 0066,www.masalogistics.com,info@masalogistics.com
un.-arab-emirates,dubai,RS LOGISTICS (RISING STAR LOGISTICS),"Room #203 Al Thani Building, Dubai, United Arab Emirates",+971 4238 5877,www.rslogisticsme.com,mustafa@rslogisticsme.com
un.-arab-emirates,dubai,INTERLINK FREIGHT AGENCY,"Cargo Mega Terminal Dubai Airport, Cargo Village, Dubai, United Arab Emirates",+971561654903,www.interlinkgulf.com,sinto@interlinkgulf.com
un.-arab-emirates,dubai,DDU SHIPPING AND LOGISTICS LLC,"Indigo Optima 307, International City, Dubai, UAE",+971 (0)4-514 8968,www.dduworld.com,ddu@dduworld.com
un.-arab-emirates,dubai,EXPERTS FREIGHT GROUP (E.F.G),"Off. 406, 4th Flr, Dubai Pearl Bldg., (Jesco Supermarket Bldg.) Nasser Square, Deira, Dubai, UA...",0097142523883,www.expertsfreight.com,rafik@expertsfreight.com
un.-arab-emirates,dubai,TRANSLINE EXPRESS,"Al Aweer Dry Port Customs, Dubai, UAE",+971 (0)4 342 3888,www.tle.ae,sales@tle.ae
un.-arab-emirates,dubai,SKY TOP CARGO SERVICES,"Opp Hyatt Regency Hotel, Othman Building, Office 103, Dubai, Deira 93315, UAE",+97143987634,www.skytopcargo.com,info@skytopcargo.com
un.-arab-emirates,dubai,"BSV SHIPPING AGENCIES LLC, DUBAI","The Atrium Centre, Dubai, UAE, United Arab Emirates",+97143587500,www.bsvship.com/,marketing.dxb@bsvship.com
un.-arab-emirates,dubai,TIGER MOVERS DUBAI,"6th Street, Near Al Fahidi Metro Station, Dubai, United Arab Emirates",+971 055 649 7550,www.tigermoversdubai.com/,info@tigermoversdubai.com
un.-arab-emirates,dubai,AIRGLOW AVIATION SERVICES FZC.,"217, Dnata D Block, FG5 Building, Dubai Airport Free Zone, Dubai - UAE.",+97142522169,www.airglowaviation.com,rohit@airglowaviation.com
un.-arab-emirates,dubai,BURHANI OASIS SHIPPING LLC,"Dubai, UAE",00971-4-2347956 / 57,www.burhanishipping.com,info_@burhanishipping.com
un.-arab-emirates,dubai,1ST UNITED CARGO DWC LLC,"DWC Business Park,. Bldg. C Off, 238. Dubai Aviation and Logistic City, Dubai, UAE",+971 4 887 9699,1stunitedcargo.com/,ouassim.khrouf@1stunitedcargo.com
un.-arab-emirates,dubai,MG SKY CARGO,"Office 903, Al Khor Plaza, Next to Dubai Creek Golf and Yacht Club, Sheikh Rashid Road, Dubai, ...",+971 4 226 10 10,www.mgskycargo.com,info@mgskycargo.com
un.-arab-emirates,dubai,SKYBIRDS XPRESS CARGO,"Al Qusaise,",+971 5 5700 2098,www.skybirdsuae.com,info@skybirdsuae.com
un.-arab-emirates,dubai,CONCORDE EXPRESS TRANSPORT LLC.,"Office#205,Khalifa Bldg. (Opposite Of Eppco),Damascus Street, Industrial 2, Al Qusais Dubai, Un...",+971 4 2207980,www.concorde.ae,wesam@concorde-cargo.com
un.-arab-emirates,dubai,EVERSHINE SHIPPING LLC,Khalid Bin Al Waleed Road (Computer Street) - Dubai - United Arab Emirates,+971 4 393 3326,www.evership.ae/,reena@evership.ae
un.-arab-emirates,dubai,TRELOG LLC - SHIPPING & PROJECTS DUBAI,"M06-AM Building, Near Apt Fz Metro, Dubai 300269, UAE",+971503009679,www.trelogs.com/,ceo@trelogs.com
un.-arab-emirates,dubai,HANS LOGISTICS LLC.,"Jebel Ali Free Zone, Extension South",+97-1 4881 1334,www.hans-logistics.com/,vincent@hans-logistics.com
un.-arab-emirates,dubai,AARAS SHIPPING LINE LLC.,"Zabeel Business center, Room # 303-3, Dubai, 119963 Dubai, UAE",+971 4225 8678,www.aarasshipping.com,h.majeed@aarasshipping.ae
un.-arab-emirates,dubai,UNIVERSUM HEAVYLIFT GROUP,"Level 41, Emirates Tower, Dubai, 31303 Dubai, United Arab Emirates",+97143132303,www.heavyliftintl.co.uk,info@heavyliftintl.co.uk
un.-arab-emirates,dubai,DCFC LOGISTICS & DISTRIBUTION L.L.C.,"P.O. Box: 2300, Jebel Ali Free Zone, Dubai - U.A.E.",+9714 8832777,www.dcfcshipping.ae/,realrafi@gmail.com
un.-arab-emirates,dubai,RDS WORLD WIDE CARGO LLC,"SORP Business Centre, Tecom, Tameem House Building, Dubai, 214950, UAE",+971 4559 4545,www.rdscargo.ae,info@rdscargo.ae
un.-arab-emirates,dubai,SPEED & SAFE CARGO LLC,"Al Mulla Warehouse - E31, Al Qusais, Dubai, United Arab Emirates",+971 (0)4-258 9956,www.speedandsafecargo.com/,info@speedandsafecargo.com
un.-arab-emirates,dubai,KANOO EXHIBTION SERVCIES,"Dubai, Airport Free Zone F-15, P.O. Box: 293782,  Dubai U.A.E.",+971 (0)4 347 6026,www.kanoofreight.com,ignatius.alva@kanoo.com
un.-arab-emirates,dubai,MAC AAA FREIGHT AND LOGISTICS LLC,"107, Al Khaleej Centre, Dubai, Dubai 1357, United Arab Emirates",+971 4359 6312,www.mac-aaafrt.com,irfan@mac-aaafrt.com
un.-arab-emirates,dubai,KR SHIPPING LLC,"P O BOX 56832, Dubai, United Arab Emirates (UAE)",+971 4 263 2656,www.kr-shipping.com,krship@eim.ae
un.-arab-emirates,dubai,DULOG REMOVALS - DIVISION OF DULOG LLC.,"Premises A-14, Phase 2, Dubai Industrial City, Dubai, United Arab Emirates (UAE)",+971555074215,www.duloggroup.com,niyazali@duloggroup.com
un.-arab-emirates,dubai,NAJD STAR FREIGHT CO,"Post Box 22572, Cargo Village, Office 2016, Dubai, United Arab Emirates",+971 4286 9070,www.najdstar.com,najdstar@eim.ae
un.-arab-emirates,dubai,CONSOLIDATED SHIPPING SERVICES LLC - CCS,"Corporate Office, P.O. Box 27802, Dubai, UAE",+97143248884,www.cssgroupsite.com,mail@cssgroupsite.com
un.-arab-emirates,dubai,FAREX CARGO SERVICES & CLEARANCE LLC,"Al Awier, Ras Al Khour, Dubai, United Arab Emirates",+971 43200340,www.farexcargo.com,sami@farexcargo.com
un.-arab-emirates,dubai,TRANSAFE LOGISTICS,"Industrial Area #1, Strainstall Building, Ground Level, Room 01, Dubai, Jebel Ali, United Arab ...",+971503858695,www.transafe.ae,ameerhussain@rediffmail.com
un.-arab-emirates,dubai,MODERN AGE SHIPPING LLC,"Al Qusais Industrial Area 3, Dubai, U A E",+971 4 263 3341,www.modernageshipping.com,info@modernageshipping.com
un.-arab-emirates,dubai,BURHANI OASIS SHIPPING LLC,"Dubai, United Arab Emirates",+971 4234 7956,www.burhanishipping.com,mail@burhanishipping.com
un.-arab-emirates,dubai,AL FARES CARGO SERVICE & CLEARANCE,"Ras Al Khor - Al Awir, Dubai, U.A.E.",0097143200340,www.alfarescargo.com,hadi@alfarescargo.com
un.-arab-emirates,dubai,PLEASANT STAR INTERNATIONAL SHIPPING LLC,"Office #404, 4th Floor Al Owais Building, Port Saeed, Dubai, United Arab Emirates",00971 4 259 5225,www.ps-intl.com,abdul_salam@ps-intl.com
un.-arab-emirates,dubai,EXPERTS FREIGHT LLC,"Nasser Square, New Badri Building, 3rd FL RM 302, Deira, Dubai -UAE",0097142523883,www.expertsfreight.com,rafik@expertsfreight.com
un.-arab-emirates,dubai,FRONTLINE LOGISTICS,"No. 5, Plot 364-243, Al Quoz  Industrial Area 1, Opp. Al Shirawi Group, Dubai, United Arab Emir...",+971 43883275,www.frontlinelogisticsgroup.com,consol.dxb@fllogistics.com
