"name","address","phone","website","profileUrl","isPremiumMember"
"North Star","RWSolutions Ltd. Unit 1406 14th Floor,  The Broadway, 54-62 Lockhart Road, Wan Chai , Wan Chai, Hong Kong, 0000","","","https://www.freightnet.com/profile/166171.htm","No"
"Africa & Asia Cargo Alliance Ltd","Unit A1, 7/F Yip Fung Industrial Bldg , 28-36 Kwai Fung Crescent, N.T., HONG KONG, 1","","","https://www.freightnet.com/profile/157631.htm","No"
"JUPITER CARGO NETWORK","Unit 1406, 14F, The Broadway,  54-62 Lockhart Road, Wanchai, Hong Kong  , Wan Chai, Hong Kong, 0000","","","https://www.freightnet.com/profile/150891.htm","No"
"RWSolutions","25th Floor, Tower One, Tern Centre,, Queen's Road Central, Hong Kong, Hong Kong, 237-251","","","https://www.freightnet.com/profile/95183.htm","No"
"Hong Kong Association of Freight Forwarding Agents  HAFFA","Room 101, 1/F., 29 Austin Road , Tsim Sha Tsui, Kowloon, Hong Kong,","","","https://www.freightnet.com/profile/16570.htm","No"
"Hong Kong Logistics Association","Unit 11, 3/F, Tins Enterprises Centre , 777 Lai Chi Kok Road, Cheung Sha Wan, Kowloon, Hong Kong,","","","https://www.freightnet.com/profile/17749.htm","No"
"Hong Kong Sea Transport & Logistics Association","Room 501, Wing Fu Building , 18-20 Wing Kut Street, Sheung Wan, Hong Kong,","","","https://www.freightnet.com/profile/17751.htm","No"