"name","address","phone","website","profileUrl","isPremiumMember"
"Apace Digital Cargo LLP","1002, Nirmal Tower, Barakhamba Road , New Delhi, Delhi, India, 110001","","","https://www.freightnet.com/profile/175033.htm","No"
"ISC Shipping Consultancy Services","R-21, Pul Prahalad Pur, Near Purani Masjid, New Delhi, Delhi, 110044","","","https://www.freightnet.com/profile/63804.htm","No"
"Umesh Kumar & Company","C-16/17, Ocean Palace, Flat No S-5 , Shalimar Garden Sahibabad, Ghaziabad, Uttar Pradesh, 2050010","","","https://www.freightnet.com/profile/20593.htm","No"
"trust banq","gurgaon , ncr, india, 110053","","","https://www.freightnet.com/profile/51981.htm","No"
"GRSC Infotech","201. 203, Grace Chambers , Andheri East, Mumbai, Maharashtra, 400093","","","https://www.freightnet.com/profile/20031.htm","No"