"name","address","phone","website","profileUrl","isPremiumMember"
"SKYPORT EXIM CORP PRIVATE LIMITED","Rajiv Gandhi Road,Old Mahabalipuram Road,Kottiwakkam , 111,Ground Floor, CHENNAI, Tamil Nadu, 600096","","","https://www.freightnet.com/profile/263675.htm","No"
"Shams Logistics","Ground Floor, Nano Wing , Haware Fantasia Bussiness Park, mumbai, Maharashtra > Greater Mumbai, 400703","","","https://www.freightnet.com/profile/256794.htm","No"
"SHREE BALAJI EXIM INTERNATIONAL","2365-A, SECTOR-3, FARIDABAD-121004 , FARIDABAD, Haryana, 121004","","","https://www.freightnet.com/profile/255804.htm","No"
"Sravanthi Transport","nellore , kavali, andhra, 524201","","","https://www.freightnet.com/profile/253707.htm","No"
"Logistics Solutions","Dynasty Business Park  , Andheri East, Mumbai, India, 400059","","","https://www.freightnet.com/profile/250604.htm","No"
"Qureshi Cold Chain","19-2-294  , Doodh Bowli, Hyderabad, Telangana, 500064","","","https://www.freightnet.com/profile/249144.htm","No"
"Logistic Integrator","1, Krushnakunj Appartment  , Maninagar, Ahmedabad, Gujarat, 380008","","","https://www.freightnet.com/profile/245012.htm","No"
"NILKANTH EXPORT IMPORT GLOBAL TRADE LLP","979, CHHATARIYA FALIYA GHEJ Ta. CHIKHLI , Di. NAVSARI State. GUJARAT INDIA, CHIKHLI, Gujarat, 396521","","","https://www.freightnet.com/profile/238615.htm","No"
"Exim","B/13 Jala ram park society ranoli vadodara  , Ranoli, Vadodara, 391350","","","https://www.freightnet.com/profile/246247.htm","No"
"Hinduja TMT","Vasanthanagar Colony Plot 868 , KPHB, HYDERABAD, Andhra Pradesh, 500085","","","https://www.freightnet.com/profile/241665.htm","No"
"Up express goods carrier","Gautam Buddha marg Lucknow  , Lucknow, Uttar Pradesh India, 226003","","","https://www.freightnet.com/profile/238908.htm","No"
"Rk Enterprises","302,ms estates A Block  , Ms estates, nizampet, hyderabad, telangana, 500090","","","https://www.freightnet.com/profile/231306.htm","No"
"Prerna Impex","Kanchanjanga , Plot 20 sector 11, Navi Mumbai, Maharashtra/India, 400709","","","https://www.freightnet.com/profile/211069.htm","No"
"AMK impex and trading","Shukrawarpeth , Kamankatti, Dharwad, India, 580001","","","https://www.freightnet.com/profile/197937.htm","No"
"Harihar Cold Storage","Rajrappa road , Gola, Ramgarh, India, 829110","","","https://www.freightnet.com/profile/198533.htm","No"
"Kuhelika International","KHAGRABARI, BURIRPAT, SHIBJAGYA ROAD , COOCH BEHAR, West Bengal, 736101","","","https://www.freightnet.com/profile/197281.htm","No"
"MAGNUM IMPEX","48 NILMONI SOM STREET , Hooghly, Hooghly, West Bengal, 712232","","","https://www.freightnet.com/profile/177581.htm","No"
"SASON INTERNATIONAL","2A,1st Floor, Nile Complex, Old HB road Kantatoli, Ranchi, India , Floor, Nile Complex, Old HB road Kantatoli, Ranchi, India, Ranchi, India, 834001","","","https://www.freightnet.com/profile/193093.htm","No"
"A I EXIMS","228/211 maqdoom nagar jajmau kanpur U.P. India , 228/211 maqdoom nagar jajmau kanpur U.P. India, Kanpur, Uttar Pradesh, 208010","","","https://www.freightnet.com/profile/186960.htm","No"
"Alpha Marine Traders","3A2 Hiland Park , Fjord, Kolkata, India, 700094","","","https://www.freightnet.com/profile/168752.htm","No"
"Jrkexports","3766 , Ashok nagar, Pudukkottai, Tamilnadu, 622001","","","https://www.freightnet.com/profile/159227.htm","No"
"Naman global Impex Pvt ltd","Shop 3 and 4. Barrack raod , New Marine Lines, Mumbai, Maharashtra, 4000020","","","https://www.freightnet.com/profile/135836.htm","No"
"ARISTAIOS GLOBAL EXIM PVT LTD","#6, GK NARAYANA RESIDENCY, 102, VENKATESWARA NAGAR, SRI SAINATH PURAM, Dr. A S RAO NAGAR, .. , Hyderabad, Telangana, 500062","","","https://www.freightnet.com/profile/135900.htm","No"
"PROGRESS OCEAN SHIPPING PVT LTD","NO 6, PARK CIRCLE, MOORES ROAD, CHENNAI 600006, CHENNAI, TAMIL NADU, 600006","","","https://www.freightnet.com/profile/135448.htm","No"
"bala agri exports","402,marriamman koil street , thattampalayam , panruti (t.k) , 607205, Tennessee, +91","","","https://www.freightnet.com/profile/97846.htm","No"
"Om shanti exports","abyudaya nagar , cotton green, mumbai, maharashtra, 400033","","","https://www.freightnet.com/profile/134531.htm","No"
"STAR ASIA CARGO PVT.LTD.","115 1ST FLOOR SHITAL SOCIETY SECTOR NO.1 CHARKOP, KANDIVALI WEST MUMBAI 400099 , MUMBAI, MAHARASHTRA/INDIA, 400099","","","https://www.freightnet.com/profile/130783.htm","No"
"Globe Logix","Office No. 2, Ameya Classic,  Sarjepura, Ahmednagar, Maharashtra, 414001","","","https://www.freightnet.com/profile/114802.htm","No"
"AL Falah Food Exports","Moradabad Road , Sambhal, sambhal, U.p. India, 244302","","","https://www.freightnet.com/profile/111912.htm","No"
"Heerva Overseas","170,PANCHVATI PARK , RAJKOT, GUJARAT, 360001","","","https://www.freightnet.com/profile/104577.htm","No"
"OMR & Sons Export Pvt Ltd","126-hari enclave colony , Bulandshahr, U.P., 203001","","","https://www.freightnet.com/profile/100477.htm","No"
"BHAVIN TRADING","WWW.BHAVINTRADING.COM , RANJIT PARA, BHANVAD, India - Gujarat, 360510","","","https://www.freightnet.com/profile/96995.htm","No"
"SARA Exports & Imports","Edappavoor , Ranni, Ranni, Kerala/India, 689614","","","https://www.freightnet.com/profile/99464.htm","No"
"rvr shipping","11-14-1 , kakinada, andhra pradesh, 533001","","","https://www.freightnet.com/profile/97547.htm","No"
"New Way International Pvt. Ltd.","HAL Blore , Bangalore, Karnataka, 560001","","","https://www.freightnet.com/profile/97053.htm","No"
"V V Exim","8 Shoham complax , Odhav, Ahmedabad, Gujarat INDIA, 382425","","","https://www.freightnet.com/profile/97044.htm","No"
"Raja Exports","121,  KVK  nagar west , Tuticorin, Tamilnadu, 628 008","","","https://www.freightnet.com/profile/53159.htm","No"
"AK India Exporters","Plot 58, Raja Srinivasan Nagar , Second Street, Thiruvanmiyur, Chennai, Tamilnadu, 600041","","","https://www.freightnet.com/profile/51540.htm","No"
"RC Global","1515 Avinashi Road , Peelamedu, Coimbatore, Tripura, 641004","","","https://www.freightnet.com/profile/13770.htm","No"
"Adit International Plastic Products Pvt Ltd","Plot # 238,Sidco Industrial Estate,Thirumudivakkam,, Pallavaram, India, 600044","","","https://www.freightnet.com/profile/50703.htm","No"
"Rajkumar India Pvt Ltd","31/B, Rishabh Chamber, Jija Mata Road , Near Ashwa Hospital, Bhuj, Gujarat, 370135","","","https://www.freightnet.com/profile/50439.htm","No"
"GSEC LTD","2nd floor,gujart chambers building,asram road,ahmedabad 380009 , ashram road, AHMEDABAD, gujarat, 380009","","","https://www.freightnet.com/profile/51099.htm","No"
"Titan Traders","#149 M.G.Road , Tasildarnagar, Tamaraikulam, Periyakulam, Madurai, Tamil Nadu, 625605","","","https://www.freightnet.com/profile/13228.htm","No"
"Uniworthimpex","30 Bentick Street , 3rd floor, Kolkata, West Bengal, 700001","","","https://www.freightnet.com/profile/14165.htm","No"
"Earth Produce Exchange","I - 585 B.R.S.Nagar , Ludhiana, Punjab, 141002","","","https://www.freightnet.com/profile/14494.htm","No"
"Shivani Enterprises","23, Sornapushpam Colony , Vankatesa Colony, Pollachi, Tamil Nadu, 642001","","","https://www.freightnet.com/profile/17488.htm","No"
"Sai Global Services","2/21,Vivekanand Society , Guru Mandir Road, Saraswat Colony, Dombivali East, Dt., Thane, Maharashtra, 421201","","","https://www.freightnet.com/profile/18200.htm","No"
"Rohini Fire Safety Pvt Ltd","61 Shambhunath Pandit Street , Other State, Kolkata, West Bengal, 700025","","","https://www.freightnet.com/profile/100071.htm","No"
"Rushabh Exports","305 Ajanta Complex, Opp Bombay Hotel , Gondal Road, Rajkot, Gujarat, 360002","","","https://www.freightnet.com/profile/103219.htm","No"
"AVSL","1072, 10 TH FLOOR , NETAJI SUBHASH PALACE , DELHI - 34, DELHI, DELHI, 1100034","","","https://www.freightnet.com/profile/118660.htm","No"