"name","address","phone","website","profileUrl","isPremiumMember"
"PT.Dora Kargo Kontena","Metropolitan Estate # Gardenia Blok RB 07 , JL.Siliwangi KM 07 Narogong, Kota Bekasi, Indonesia, 17117","","","https://www.freightnet.com/profile/212965.htm","No"
"MontieCharlo Shipping","Perum IKIP Gununganyar Indah VIII F173 , Graha Pasific Building 2nd FLOOR JL. Jend Basuki Rahmat No.87-91, Surabaya, indonesia, 60294","","","https://www.freightnet.com/profile/208665.htm","No"
"KCargo Agencies","Mitra Sunter, Fifth Floor, suite 503 , Jl. Yos Sudarso, Kav 89, Jakarta, 14350","","","https://www.freightnet.com/profile/2904.htm","No"
"MAP TRANSLOGISTIC","Menara Satu Sentra Kelapa Gading Jl. Boulevard Blok LA 3 No.1, 6th Floor - Unit 0603 Kelapa Gading Timur, Jakarta Utara 14240.  , JAKARTA TIMUR, indonesia, 14240","","","https://www.freightnet.com/profile/221585.htm","No"
"G&F express","Jalan tsafiuddin no. 1 , Singkawang, Kalimantan Barat, 79111","","","https://www.freightnet.com/profile/203504.htm","No"
"PT.NUSANTARA INHIL LINE PEKANBARU","Jalan Tanjung Datuk No 141 E Pekanbaru , Riau, PEKANBARU-Riau, 28262","","","https://www.freightnet.com/profile/155006.htm","No"
"WUULINE, PT","Ruko Enggano Megah Blok 5-S , Jl. Enggano Raya, Tanjung Priok, Jakarta, 14310","","","https://www.freightnet.com/profile/11371.htm","No"
"Norasia Container Line","S.Wisjoyo Building 5th Floor , Jl Jend Sudirman 71, Jakarta, 12190","","","https://www.freightnet.com/profile/11838.htm","No"