"name","address","phone","website","profileUrl","isPremiumMember"
"BOCHIMA BROKERAGE FIRM","Bucannah and Front Street , Barnersvillie Township, Monrovia, Montserrado, 0000","","","https://www.freightnet.com/profile/192019.htm","No"
"Bochima Brokerage Firm","Front Street , Monrovia, Montserrado, Montserrado, 0000","","","https://www.freightnet.com/profile/243347.htm","No"
"GLOBAL LOGISTICS SERVICES (GLS)","1st floor, Jubilee Plaza Building. Tubman Boulevard, Congo Town. Monrovia, Liberia , Monrovia, Montserrado, 1000","","","https://www.freightnet.com/profile/231868.htm","No"
"Dominion International Group Companies","Brewerville Monsterrado Monrovia Liberia , Brewerville Monsterrado Monrovia Liberia, Red Hill Field, Monsterrado, 1000","","","https://www.freightnet.com/profile/193770.htm","No"
"Astech Clearing and forwarding","Broad and Randell street , Monrovia, Montserrado, 1000","","","https://www.freightnet.com/profile/157286.htm","No"