"name","address","phone","website","profileUrl","isPremiumMember"
"YEN HONG MARINE SDN. BHD.","7, JALAN MAWAI JAYA , TAMAN MAWAI JAYA, KOTA TINGGI, Johor, 81900","","","https://www.freightnet.com/profile/230497.htm","No"
"Raffles Movers International Pte Ltd","No.5 Jalan TIB 1/21 Taman Industri Bolton, 68100 Batu Caves, Selangor , Kuala Lumpur, Selangor, 68100","","","https://www.freightnet.com/profile/85639.htm","No"
"METRECON RESOURCES (INTERMODAL DIVISION)","15 LRG DE 4C / KAW 9 , KLANG, SELANGOR MALAYSIA, 41200","","","https://www.freightnet.com/profile/103000.htm","No"
"Asian Shield Freight Forwarders Sdn Bhd","Lot 15, Lingkaran Sultan Muhamed 2 , Kawasan Perusahaan Bandar Sultan Suleiman, Port Klang, Selangor, Darul Ehsan, 42000","","","https://www.freightnet.com/profile/12396.htm","No"
"Inter Global Express","No.7 First Floor, Jalan PJS 7/22. , Bandar Sunway, Petalin Jaya, Selangor, Darul Ehsan, 46150","","","https://www.freightnet.com/profile/17675.htm","No"
"SNT Movers","13 , BU 5 , Section 5, Shah Alam, Selangor, Malaysia, 47150","","","https://www.freightnet.com/profile/115072.htm","No"