"name","address","phone","website","profileUrl","isPremiumMember"
"VJ INTERKARGO SA DE CV","MONTES URALES 755 PISO 5 OFICINA 5314 , LOMAS DE CHAPULTEPEC IV SECCION DEL MIGUEL HIDALGO, MEXICO, Ciudad de México, 11000","","","https://www.freightnet.com/profile/187047.htm","No"
"Logimex internacional","147 NO. 914 X 46-C Y 48 JARDINES DEL SUR , merida, MEXICO, 97285","","","https://www.freightnet.com/profile/131321.htm","No"
"BSM Forwarding","Sócrates 207 Polanco II sección, 11530 Miguel Hidalgo , Ciudad de México, Estado de México, 11530","","","https://www.freightnet.com/profile/253030.htm","No"
"Seal Soluciones Logisticas","MANZANILLO , MANZANILLO, MANZANILLO, 28219","","","https://www.freightnet.com/profile/130187.htm","No"
"Canamericas World Trading Co (Mexico) .","Ave Batallón de San Patricio Sur 109 , Floor 17A, San Pedro Garza García, Nuevo Leon, Mexico, 66260","","","https://www.freightnet.com/profile/197511.htm","No"
"LOGISTICA ADUANAL BG","BAHIA DE MORLACO 82 , MIGUEL HIDALGO, MEXICO DF, 11300","","","https://www.freightnet.com/profile/111180.htm","No"
"Profesionales en Transporte Internacional, SC","Calle 22 No. 28, San Pedro de los Pinos , Mexico, D.F., 03800","","","https://www.freightnet.com/profile/22926.htm","No"
"Interlogistiks","Vía José López Portillo #6 , Tultitlán, Estado de México, México, 54940","","","https://www.freightnet.com/profile/86960.htm","No"
"FREIGHTING","Zapopan, Jalisco , Zapopan, Jalisco, 45040","","","https://www.freightnet.com/profile/61708.htm","No"