"name","address","phone","website","profileUrl","isPremiumMember"
"Quickserve Logistics Nigeria","Divine Favour plaza, Suite D14, No. 103, Egbeda Akowonjo Road , Egbeda Ikeja, Lagos Nigeria, 0234","","","https://www.freightnet.com/profile/149324.htm","No"
"Nellosun Nig Ltd","10 industrial road, olodi apapa lagos nig. , lagos city, lagos / nig, 234","","","https://www.freightnet.com/profile/149139.htm","No"
"Zubnet Concept ltd","31/37, ibari road, Cele b/stop. off moshalasi b/stop.Alagbado , Alagbado, Lagos state. Nigeria, +23402035","","","https://www.freightnet.com/profile/148973.htm","No"
"Italair Nigeria Limited","Suit109, Nahco complex, cargo village, M.M.I.Airport,, Ikeja, Lagos, Nigeria, +2341","","","https://www.freightnet.com/profile/108480.htm","No"
"KSP Shipping and Logistics Ltd","3B, Banana Close, Off Lateef, Salami str Airport Rd, Ajoa Estata, Isolo Lagos. , Lagos, Lagos, 100263","","","https://www.freightnet.com/profile/137758.htm","No"
"Afroprexsu Shipping & Oil Services Ltd","3, Daniel Close off Elijiji Avenue Road, Woji , 3, Daniel Close off Elijiji Avenue Road, Woji, Port Harcourt, Rivers/Nigeria, 500002","","","https://www.freightnet.com/profile/128924.htm","No"
"DFL LOGISTICS LTD","1st floor magnet shopping plaza,Ladipo, Oshodi Agege Express Road, Lagos , KLT Phase 1, Brawa, Olodi Apapa, Lagos, Apapa, Lagos/Nigeria, 102241","","","https://www.freightnet.com/profile/148059.htm","No"
"DFL LOGISTICS LTD","1st floor magnet shopping plaza,Ladipo, Oshodi Agege Express Road, Lagos , KLT Phase 1, Brawa, Olodi Apapa, Lagos, Apapa, Lagos/Nigeria, 102241","","","https://www.freightnet.com/profile/148058.htm","No"
"Dulux  Aircargo Limited","52,M.M.Airport Road,oppiste Ajao Estate,Ikeja Lagos , Ikeja, Lagos,State, 23401","","","https://www.freightnet.com/profile/147522.htm","No"
"SKB FREIGHT SERVICES LIMITED","31 MM INTERNATIONAL AIRPORT ROAD , AJAO ESTATE, LAGOS, NIGERIA, 2341","","","https://www.freightnet.com/profile/147463.htm","No"
"Henrio Logistics","29/31 Obafemi Awolowo way , ikeja, Lagos, 23401","","","https://www.freightnet.com/profile/146617.htm","No"
"Ftia International Services Ltd","34, Kofo Abayomi Street, Apapa. , Lagos, Nigeria, 102211","","","https://www.freightnet.com/profile/139052.htm","No"
"ROSKA STEVENS LTD","44, ABEOKUTA STREET , ANIFOWOSHE- IKEJA, IKEJA, LAGOS STATE, NIGERIA, 1234","","","https://www.freightnet.com/profile/107214.htm","No"
"Worldwide Freight System Nig. Ltd","113 wing a, 1st flr, nahco cargo complex, Muritala Muhammed int'l airport, ikeja, Lagos Nigeria  , ikeja, Lagos, Nigeria, 23401","","","https://www.freightnet.com/profile/145275.htm","No"
"Obokun Freight Forwarders Ltd","24 , Burma Road, Apapa, Lagos/Nigeria, 1234","","","https://www.freightnet.com/profile/145211.htm","No"
"KSS Transportation Solutions Ltd","50 Adegbola Street Anifowoshe Ikeja Lagos Nigeria , Block 7 Close 7 Elekahia Estate PortHarcourt Rivers State Nigeria, Lagos, Nigeria, +234","","","https://www.freightnet.com/profile/144735.htm","No"
"U.I JOHN AGENCY LIMITED","48, CRECENT APAPA, LAGOS NIGERIA. , 4, ALIMOSHO ROAD, DOPEMU, LAGOS NIGERIA, LAGOS, LAGOS, NIGERIA, +234","","","https://www.freightnet.com/profile/136097.htm","No"
"Deluxe Vista Ltd","1/3 Creek Road , Nnewi House, Apapa, Lagos nigeria, 100275","","","https://www.freightnet.com/profile/144408.htm","No"
"ELOHIM SHIPPING CO. LTD","NO 32, OSHODI APAPA EXPRESSWAY, WAREHOUSE BUS STOP, BEHIND FIRST BANK PLC, APAPA, LAGOS, NIGERIA , APAPA, LAGOS, 25019","","","https://www.freightnet.com/profile/143538.htm","No"
"bennyme express Nig Ltd","no31 m/m international airport road,ajao estate.Lagos Nigeria. , LAGOS, LAGOS, NIGERIA., 234","","","https://www.freightnet.com/profile/143134.htm","No"
"khome Global Logistics Limited","18 Itapuju Street Apapa Lagos , 28d Oduluku Road Off School Road Port Harcourt, Apapa, Lagos Nigeria, +234","","","https://www.freightnet.com/profile/137320.htm","No"
"B. A. Britez ILS Nigeria Limited","House 12, Road 33, Trans Amadi Garden Estate, Peter Odili Road , Port Harcourt, Rivers State, Nigeria, 234","","","https://www.freightnet.com/profile/143535.htm","No"
"EAGLE AIR & SEA FREIGHTS SERVICES LTD","5B BASHORUN ROAD IBADAN , 8 JOY AVENUE, OFF INTERNATIONAL AIRPORT ROAD, IBADAN, NIGERIA, 91300","","","https://www.freightnet.com/profile/143448.htm","No"
"Delta Force Logistics Ltd","Apapa, Lagos , MM Nacho complex, Lagos, Apapa, Lagos/Nigeria, 102241","","","https://www.freightnet.com/profile/143422.htm","No"
"St Joseph Technologies Limited","3, Alao Street, Off Osolo Way,By 7 & 8 B/Stop, MM Int\'l Airpot Road. Ajao Estate. , 24, Burma Road, Apapa., Osodi-Isolo, Lagos, Nigeria, 234-01","","","https://www.freightnet.com/profile/129753.htm","No"
"ugochukwu","No 13 lslo way opp   U BA bank  airport  road lkeja Lagos , 13  lslo way opp U BA bank airport road ikeja Lagos, ikeja, lagos Nigeria, pox ikeja","","","https://www.freightnet.com/profile/141031.htm","No"
"Oceantrack Agency Ltd","34, Cyril Njoku Street , Ejigbo, Lagos, 23401","","","https://www.freightnet.com/profile/142623.htm","No"
"Combinenet Logistics Nigeria Limited","SuiteIV Sahcol Cargo Complex M.M Int'l Airport Ikeja Lagos Nigeria  , Ikeja, Lagos, 2341","","","https://www.freightnet.com/profile/142536.htm","No"
"Ajuh Logistics","8 Samuel Street Mafoluluku , Oshodi, Mafoluluku, Lagos, 234","","","https://www.freightnet.com/profile/49630.htm","No"
"BFL Logistics","Block 7, Beesam Complex , Murtala Muhammed  Airport Road, Ikeja, Ikeja, 100001","","","https://www.freightnet.com/profile/142068.htm","No"
"C CARGO SOLUTION INTERNATIONAL LTD","9 ABIODUN STREET SOMOLU LAGOS , 9 ABIODUN STREET SOMOLU LAGOS, LAGOS, LAGOS/NIGERIA, 23401","","","https://www.freightnet.com/profile/53465.htm","No"
"HEFSIBA WORLDWIDE LOGISTICS LIMITED","PLOT 518, IKORODU ROAD, ILE-ILE, KETU, LAGOS , NOT APPLICABLE, KETU, LAGOS, +234","","","https://www.freightnet.com/profile/141126.htm","No"
"Denca Global Courier Company Limited (DGC Express)./ Denca Services Limited.","20 Park Lane, Apapa GRA, Apapa, Lagos, Nigeria. , Plot C41, Amuwo Odofin Commercial Scheme, Oba Kayode Akinyemi Way, Amuwo Odofin, Lagos, Nigeria, Lagos, Nigeria, 234","","","https://www.freightnet.com/profile/140884.htm","No"
"Denca Global Courier Company Limited/Denca Services Limited","20, PARK LANE,APAPA G R A,APAPA,LAGOS,NIGERIA. , PLOT C41 AMUWO ODOFIN COMMERCIAL SCHEME,OBA KAYODE AKINYEMI WAY,AMUWO ODOFIN,LAGOS,NIGERIA., LAGOS, LAGOS STATE,NIGERIA., +234","","","https://www.freightnet.com/profile/140269.htm","No"
"ROAG Comercial Nigeria Limited","3rd floor Bamigbola House,109, Lagos/Abeokuta express way, Adealu Bus stop, Lagos, Lagos, 100001","","","https://www.freightnet.com/profile/140171.htm","No"
"Ashbond Logistic Limited","11,ADEYEMO STREET MURTAL MUHAMMED INT'L AIRPORT , OFF 7/8 BUS-STOP, OSHODI-ISOLO, LAGOS, +23401","","","https://www.freightnet.com/profile/96675.htm","No"
"EARLYPICK SERVICE SOLUTIONS LTD","3, ARAROMI STREET, ANIFOWOSHE, IKEJA LAGOS, NIGERIA  , IKEJA, LAGOS STATE/ NIGERIA, +234","","","https://www.freightnet.com/profile/134373.htm","No"
"FEDUBB NIGERIA LIMITED","BLOCK A,SUITE 2,IKLG COMPLEX,IKEJA,LAGOS,NIGERIA , 2,OGUNYINKA STREET,INTERNATIONAL AIRPORT ROAD,LAGOS,NIGERIA, LAGOS, LAGOS, 234-1","","","https://www.freightnet.com/profile/52798.htm","No"
"trinity international logistics","plot 22 islamic street  , plot 16 jibowu avenue, ikotun, lagos nigeria, 23401","","","https://www.freightnet.com/profile/137526.htm","No"
"ALOV AIR SEA LTD (HQ)","HQ: Lagos Nigeria/West Africa 8 Abiodun Wright off cole, Masha end Surulere, Lagos. , LAGOS, LAGOS/NIGERIA, 100001/188","","","https://www.freightnet.com/profile/95730.htm","No"
"HYBEE GLOBAL LOGISTICS","115, HAJI CAMP COMPLEX IKEJA LAGOS , 29, ADESHINA FADEYI LAGOS, IKEJA, LAGOS, +234","","","https://www.freightnet.com/profile/137063.htm","No"
"Orion Global Corporate Solutions","No 39 Wosila Street , Off Baruwa Road, Ijesha, Lagos, 01","","","https://www.freightnet.com/profile/138470.htm","No"
"ALOVAIR-SEA LTD","8,Ilesanmi Off Adegoke Street ,Masha  Surulere Lagos , 8,Ilesanmi Off Adegoke Street ,Masha  Surulere Lagos, Surulere, Lagos, 100001","","","https://www.freightnet.com/profile/113506.htm","No"
"Destiny Cargo Nigeria Limited","22 Omolade Oshilowo Street Off Beesam Bus Stop lagos State , 28d  Odulukwu road Off school road Elelenwo Port Harcourt, River, Nigeria, +234","","","https://www.freightnet.com/profile/130767.htm","No"
"Orbital Concepts Logistics Solution","22A, Murtala Muhammed International Airport Road , Ajao Estate, Isolo, Lagos, 234100","","","https://www.freightnet.com/profile/138050.htm","No"
"Ebentina International Limited","14 OJOLOWO IMOSHE STR, OFF ODUYEMI STR, ANIFOWOSHE AREA, IKEJA LAGOS, LAGOS, Lagos, 100281","","","https://www.freightnet.com/profile/17061.htm","No"
"Qualicare Global Logistics Limited","4 Nwobodo eze Street , Ajao, Ikeja, Lagos, 23401","","","https://www.freightnet.com/profile/137895.htm","No"
"upright Int'l Logistics Ltd","12 Musa Oyinbo street  , Mafoluku, Lagos, 23401","","","https://www.freightnet.com/profile/137575.htm","No"
"IGNATO VENTURES ENT.","NO 10 INDUSTRIAL ROAD 2nd FLOOR OFF , APAPA/OSHODI EXPRESSWAY WESTMINSTER/, TRINITY BUS STOP APAPA, Lagos/ Nigeria, 23401","","","https://www.freightnet.com/profile/132634.htm","No"
"Wax Logistics Nig Ltd","7, Bolo Streer, D/Line. , Port Harcourt, Rivers, 23401","","","https://www.freightnet.com/profile/135975.htm","No"
"Cotoaz shipping and logistics ltd","13/15, SAPELE ROAD,, Apapa, Lagos, 101010","","","https://www.freightnet.com/profile/121460.htm","No"
"govicon freight international nigeria limited","No 62 borno crescent apapa  , 3a afolabi sole street okota, apapa, lagos state, +234","","","https://www.freightnet.com/profile/137074.htm","No"
"Atjglobalservices","6,airport road,mm2 int'l 7&8 bus stop , Ikeja, Lagos, 1234","","","https://www.freightnet.com/profile/136757.htm","No"
"YISCO GOLDEN TRAVEL & TOURS LIMITED","8 ADEJUMO TENNIS CLUB ROAD AJAO ESTATE EXTENTION  , EJIGBO LAGOS, EJIGBO, LAGOS  NIGERIA, 2341","","","https://www.freightnet.com/profile/133508.htm","No"
"DELAR FREIGHT AND LOGISTICS SERVICES","44 BOMBAY CRESCENT, APAPA LAGOS , LAGOS, lagos, 23401","","","https://www.freightnet.com/profile/135918.htm","No"
"LOREN SHIPPING LIMITED","15 Osolo Way Opposite UBA Ajao Estate,Isolo Lagos , 18, Emekeku D Line Port Harcourt,RIVERS STATE., Lagos, Nigeria, +234","","","https://www.freightnet.com/profile/135857.htm","No"
"wax logistics ltd","7 bolo street,d/line , km 5 eneka igwurita road, port harcourt, rivers,nigeria, 7 bolo street","","","https://www.freightnet.com/profile/135841.htm","No"
"Exquisite Managers Nig Ltd","12 owodunni st off ikosi rd ketu , lagos, NIGERIA, 23401","","","https://www.freightnet.com/profile/63464.htm","No"
"sphericalearth Limited","2,oteomi  street,papa-ajao , muhin, lagos, 23401","","","https://www.freightnet.com/profile/113772.htm","No"
"Merrytime Freight Forwarding Co., Ltd.","#30, Commercial Road, Apapa, Nigeria, 01234","","","https://www.freightnet.com/profile/134801.htm","No"
"Femda Cargo Express Nigeria Limited","no 31 murtala mohammed international airport road,ajao estate.Lagos Nigeria , Lagos state, Nigeria, +234","","","https://www.freightnet.com/profile/134650.htm","No"
"Javabell Global Ltd","8b, Ilesanmi Str, Off Adegoke Estate  , Masha End, Surulere, Lagos Nigeria, 100001","","","https://www.freightnet.com/profile/134535.htm","No"
"konnect global system Limited","23 ojumiri , ajao estate  , lagos, lagos/Nigeria, 23401","","","https://www.freightnet.com/profile/134315.htm","No"
"WORLD RECEIVER CARGO SERVICES LTD","11A,NAHCO COMPLEX MURITALA MUAHMMED AIRPORT IKEJA , 1,MODUPE STREET ANIFOWOSHE IKEJA, LAGOS, LAGOS, +23401","","","https://www.freightnet.com/profile/134294.htm","No"
"ECS SHIPPING LTD","13B CREEK ROAD APAPA , LAGOS NIGEIRA, APAPA, LAGOS STATE / NIGERIA, G.P.BOX 4434","","","https://www.freightnet.com/profile/49576.htm","No"
"SHAFI EVER-RIGHT ENT LTD","21, WHARF ROAD APAPA  , LAGOS, NIGERIA, 234","","","https://www.freightnet.com/profile/92978.htm","No"
"Alpha Baro Company International limited","NO, 2 Cargo rd, Akanu Ibiam Int. Airport  - Enugu , Emene- Enugu, ENUGU  STATE, 234","","","https://www.freightnet.com/profile/101205.htm","No"
"a.d ten ventures ltd","8/10 osolo way,off int'l airport road, ajao estate, lagos, nigria, 23401","","","https://www.freightnet.com/profile/46822.htm","No"
"Fast Clear Nigeria Limited","14/16 Osolo way, Olundegun House, Ajao Estate Ikeja , Lagos, Lagos/Nigeria, 122","","","https://www.freightnet.com/profile/24238.htm","No"
"CELPHA RESOURCES LTD","NO 15 MARY THOMAS ST.YEWANDE , AS ABOVE, GIWA, OGUN/NIGERIA, 234","","","https://www.freightnet.com/profile/133818.htm","No"
"DSM NIGERIA LIMITED","plot 820, 64 crescent , Nnamdi azikiwe international airport abuja, gwarinpa, Abuja, 23409","","","https://www.freightnet.com/profile/115712.htm","No"
"GIMMS LINK GLOBAL NIGERIA LIMITED","WING A ,NAHCO COMPLEX ,INTERNATIONAL AIRPORT.LAGOS ,NIGERIA , LAGOS,IKEJA, LAGOS/NIGERIA, 234-1","","","https://www.freightnet.com/profile/53549.htm","No"
"EAGLE EYES SHIPPING LTD","2nd floor, no 10 industrial road, off apapa-oshodi expressway, trinity b/stop, olodi-apapa,, Lagos, Lagos, 01","","","https://www.freightnet.com/profile/53306.htm","No"
"Dotrans Global Services limited","06,Oyetola Street off Abeni Bakare street, near international airport road,Mafoluku Oshodi Lagos,Nigeria , 050,FAAN office,beside Panapina office,Haji camp,cargo terminal,Ikeja lagos, Ikeja and Apapa, Lagos, 0234","","","https://www.freightnet.com/profile/132753.htm","No"
"Freightworks Global Limited","22 James Robertson Street , Surulere Lagos, Lagos, Lagos State, NG 01","","","https://www.freightnet.com/profile/127623.htm","No"
"flysafe international logistics limited","59 international airport road lagos , office A, customs processing centre Forum Comlex ikeja, ikeja, lagos/nigeria, 01/234","","","https://www.freightnet.com/profile/102137.htm","No"
"joanrainbow","48,muritala muhammed int'l airport road , mafoluku junction, lagos, Lagos, 234","","","https://www.freightnet.com/profile/133468.htm","No"
"Allizzycargo Sservices Nigeria Ltd","57, Old Abeokuta Motor Road , Isale Oja Agege, Lagos, los, 234-1","","","https://www.freightnet.com/profile/18811.htm","No"
"Soonland Cargo Logistics","50, Oshobu St, Off Toll Gate, Sango Otta, Ado Odo Ota, Ogun, 234111","","","https://www.freightnet.com/profile/90444.htm","No"
".SMILENIKS LOGISTICS  LTD & GOLD ATLANTICS VENTURES LTD","Head Quarter..No 37 Alhaja Agbeke St Ago Okota  Lagos , No .10 Community road Of Allen Ikeja, Isolo/Ikeja, Lagos, 23401","","","https://www.freightnet.com/profile/117531.htm","No"
"Delight Logistics Nig Ltd","Nahco complex,Molutala Mohammed International Airport,Lagos Nigeria , Ikeja, Lagos, 234","","","https://www.freightnet.com/profile/86881.htm","No"
"Honesty Cargo Serices Ltd","ANLCA New Sec Office, opposite Hadji Camp Police Station M.M.Ikeja lagos Nigeria. , Nahco M  M Airport I keja Lagos Nigeria, A N C L A House Ikeja Lagos, Lagos, +234 NG","","","https://www.freightnet.com/profile/131962.htm","No"
"Apex Global Logistics Limited","14 Ileshomi street, off local airport , By beesam police station, Ikeja, Lagos, 234","","","https://www.freightnet.com/profile/132757.htm","No"
"CEDAR GLOBAL LOGISTICS SERVICES","3, FADIYA STREET KETU OFF DEMURIN ROAD KETU, LAGOS STATE , 11, ADEYEMO STREET, OFF 7&8 BUSTOP ALONG, IKEJA, NIGERIA, 01234","","","https://www.freightnet.com/profile/98068.htm","No"
"Compact Logistics International Limited","5, Olaide Tomori Street, Off Olu Koleosho , By Simbiat Abiola Road, Ikeja, Lagos, 2341","","","https://www.freightnet.com/profile/14498.htm","No"
"ENNYDAM EXPRESS LOGISTICS SERVICES","30, Olakunle Selesi Crescent,  Ajao Estate , Lagos State, Nigeria, 23401","","","https://www.freightnet.com/profile/132615.htm","No"
"Royetol Nigeria Enterprises","9 Community Road Obadore Lagos , 9 Community road Obadore Lagos, Obadore, Lagos / Nigeria, 234","","","https://www.freightnet.com/profile/101482.htm","No"
"Nellosun Nigeria Limited","2nd Floor, 10 Industrial Road Olodi-Apapa Lagos , Lagos, nigeria, 11001","","","https://www.freightnet.com/profile/128940.htm","No"
"Plus grace xpresserv limited","no 48 murtala international airport junction oshodi lagos, Nigeria. , no 22 olusoji street oshodi lagos, Nigeria., ikeja, Nigeria, +234","","","https://www.freightnet.com/profile/131079.htm","No"
"Nellosun Nigeria Ltd","10 Industrial Road Olodi Apapa Lagos, Nigeria. , Lagos, Lagos, 110001","","","https://www.freightnet.com/profile/131335.htm","No"
"Nuzon Ventures","Suite E10,4th Floor,SHM Complex,Mabuchi Express Way .Abuja , Mabuchi, Abuja FCT, 900211","","","https://www.freightnet.com/profile/114882.htm","No"
"ABGLONA LOGISTICS LIMITED","Suite 1, Right Wing, 2nd Floor, Pisces Block, Eleganza Plaza, Lagos, Lagos/Nigeria, 101251","","","https://www.freightnet.com/profile/127770.htm","No"
"Transconnex International Ltd","5, Yinusa Adeniji Street,  Off John Olugbo Street,  Ikeja, Lagos, Nigeria. , ikeja, lagos Nigeria, +234-01","","","https://www.freightnet.com/profile/130950.htm","No"
"Blessed Global Shipping and Logistics Nig. Ltd","81 ikeja plaze mobalaji anthony way ikeja lagos Nigeria , 24 hassan street ajao estate, ikeja, Lagos, +234","","","https://www.freightnet.com/profile/129568.htm","No"
"Heedbernshipping Nigeria Limited","No 12 , Borno Cresent, Lagos, Nigeria, +234","","","https://www.freightnet.com/profile/128166.htm","No"
"Precision and Zodiak International","41 Osolo Way off Muritala Muhammed Airport Road , Ajao, Lagos Nigeria, +234","","","https://www.freightnet.com/profile/129656.htm","No"
"Cargo Galaxy Limited","Behind Nahco warehouse, Abuja airport , Abuja.Nigeria , Ajami plaza ,area 3 Garki Abuja, FCT , Abuja, Capital of Nigeria, 6118","","","https://www.freightnet.com/profile/91436.htm","No"
"Ateeyat Logistics International Limited","DEFIN HOUSE , 106/108, Oshodi Apapa Express Way, Isolo, Lagos, 2341","","","https://www.freightnet.com/profile/96946.htm","No"
"cargoland nigeria limited","Corporate Head Office: 25 orelope Street,Orelope B/Stop Egbeda Lagos. , lagos, Nigeria, 2341","","","https://www.freightnet.com/profile/51658.htm","No"
"YET","YET , YET, LAGOS, LAGOS STATE, 01","","","https://www.freightnet.com/profile/118309.htm","No"
"Heedbern Shipping Nigeria Limited","12 Bornu Cresent Apapa    Lagos , LAGOS, NIGERIA, +23401","","","https://www.freightnet.com/profile/129039.htm","No"
"NARIMSTAR NIGERIA LIMITED","C/O NAMTECH GROUP,PLOT4 BLOCKA, APAPA-OSHODI EXPRESSWAY, LAGOS, LAGOS STATE/NIGERIA, 234","","","https://www.freightnet.com/profile/96366.htm","No"
"Heedbern Shipping Nigeria Limited","12 Bornu Cresent Apapa    Lagos , Same As Above, Lagos, lagos/Nigeria/west africa, 01234","","","https://www.freightnet.com/profile/127545.htm","No"
"Smartplus Logistics Solutions Ltd","17 Lambo Street,, Ketu, Nigeria, 234","","","https://www.freightnet.com/profile/120468.htm","No"
"DAN DAVIES VENTURES LIMITED","10 Yemi Adetayo street,ilasan , lekki ll Epe ex-way Lagos, lagos, Lagos, 2341","","","https://www.freightnet.com/profile/118709.htm","No"
"2ACHIEVECARGO WORLD WIDE","NO 17, Muritala Mohammed International Airport Road Ajao Estate Lagos Nigeria , lagos, Nigeria, 234","","","https://www.freightnet.com/profile/117782.htm","No"
"UBURU MARITIME LTD","19 Shomide Street Mangoro Agege , Apapa, Lagos, 0234","","","https://www.freightnet.com/profile/114319.htm","No"
"FAITH CARGO NIGERIA LIMITED","11 jide ogunboan street alakuko , ALAKUKO, LAGOS NIGERIA, 23401","","","https://www.freightnet.com/profile/51045.htm","No"
"MCCADO IMPEX GLOBAL RESOURCES","133 Idewu St.Olodi-apapa , Lagos, Nigeria, 01234","","","https://www.freightnet.com/profile/59155.htm","No"
"OPAK RESOURCES INT'L. NIG. LTD","31,Murtala Mohammed Int\'l Airport Road,Mafoluku B/S,by Ajao Estate , Ikeja, Lagos, 100261","","","https://www.freightnet.com/profile/106269.htm","No"
"KLASSLIFT GLOBAL ASSOCIATES","MM CARGO INT'L AIRPORT IKEJA LAGOS , 21 OGUNLANA STR EGBEDA LAGOS NIGERIA, LAGOS, lagos, 234","","","https://www.freightnet.com/profile/22399.htm","No"
"C .G. S. L","LAGOS , LAGOS, LAGOS, NIGERIA, 23401","","","https://www.freightnet.com/profile/119090.htm","No"
"DEE ODILADI GLOBAL MERCHANDISE LTD","SUITE 312, MAGNET PLAZA,LADIPO BUSTOP,AGEGE MOTOR ROAD, LAGOS STATE, AGEGE MOTOR ROAD, LAGOS STATE, 2341","","","https://www.freightnet.com/profile/127243.htm","No"
"NEATENVIRON LOGISTICS LIMITED","1B LANDER CLOSE, OFF LIVERPOOL ROAD, APAPA, LAGOS/NIGERIA, 23401","","","https://www.freightnet.com/profile/96022.htm","No"
"JAXMAT NIGERIA LIMITED","33,CREEK ROAD,IBRU HOUSE,APAPA LAGOS. , 14a IKOLABA PLAZA,IJESHA B/STOP,APAPA-OSHODI EXPRESSWAY,LAGOS., APAPA, LAGOS,NIGERIA., +234","","","https://www.freightnet.com/profile/102295.htm","No"
"NAJAS GLOBAL LOGISTICS","9 HOLY SAVIOUR ST ISOLO LAGOS , 20A LATEEF SALAMI ST AJAO ESTATE LAGOS ISOLO., ISOLO, LAGOS/NIGERIA, +234","","","https://www.freightnet.com/profile/58523.htm","No"
"philconufo international ltd","43, okeoloruntedo street ijeshatedo surulere , 43, okeoloruntedo street ijeshatedo surulere, surulere, lagos, +234","","","https://www.freightnet.com/profile/127324.htm","No"
"Adel global agency","204,faan complex,airport road,ikeja lagos,nigeria , Ikeja, Lagos, 23401","","","https://www.freightnet.com/profile/102717.htm","No"
"CELPHA RESOURCES LIMITED","2,ADEWALE CRESENT,OFF EWENLA.OSHODI , OSHODI, LAGOS/NIGERIA, 234","","","https://www.freightnet.com/profile/117564.htm","No"
"Netcargo Nigeria Limited.","Plot 18, Ijoko Road , Ojodu, Ogun State, NG 567","","","https://www.freightnet.com/profile/100481.htm","No"
"ROYETOL NIGERIA  ENTERPRISES","9, COMMUNITY ROAD OBADORE LAGOS , 9 , COMMUNITY ROAD OBADORE LAGOS, OBADORE, LAGOS/ NIGERIA, +234","","","https://www.freightnet.com/profile/104723.htm","No"
"Widescope Inti Logisitic Ltd","Suit 007 Nacho complex , MMA,Ikeja, Lagos State, Nigeria, 234 01","","","https://www.freightnet.com/profile/85698.htm","No"
"Oba`s Cargo logistics limited","180 A wing cargo tarminar ikeja airport , 5 ; Anuoluwapo mowe ogun state, ikeja, Lagos Nigeria, 01/+234","","","https://www.freightnet.com/profile/109532.htm","No"
"VG Global Investment Limited","19, Assoland Street , Off Beesam, Via Airport Road, Oshodi, Lagos, 00234100","","","https://www.freightnet.com/profile/117602.htm","No"
"blessedmarvey Nig Ltd","9 asoland street, Besam oshodi, Ikeja , 10 association olori, Akute., ikeja, Lagos, Nigeria, 234","","","https://www.freightnet.com/profile/119643.htm","No"
"Vistakaz cargo services","Nigerian Aviation Handling Company Complex, inside export shed opposite Nahco head office,off international airport road,ikeja lagos nigeria. , Ikeja, Lagos state, 234","","","https://www.freightnet.com/profile/109893.htm","No"
"TANYE SERVICES NIG LIMITED","51 ABA JOHNSON OFF ADENIYI JONES , IKEJA, LAGOS STATE, 234","","","https://www.freightnet.com/profile/117709.htm","No"
"TOUCH LOGISTIC  SERVICES","NO 18 TENNIS CLUB  ROAD OSOLO  WAY , LAGOS, NIGERIA, 23401","","","https://www.freightnet.com/profile/115004.htm","No"
"DATOL EXPRESS COURIER SERVICE LTD","NO 8,ADEYEMO STREET OFF MM AIRPORT ROAD 7\\\\\\\\\\\\\\\\8 BUS\\\\\\\\\\\\\\\\STOP MAFOLUKU OSHODI LAGOS NIGERIA , NO 8,ADEYEMO STREET OFF MM AIRPORT ROAD 7\\\\\\\\\\\\\\\\8 BUS\\\\\\\\\\\\\\\\STOP MAFOLUKU OSHODI LAGOS NIGERIA, LAGOS, LAGOS STATE NIGERIA, +234","","","https://www.freightnet.com/profile/52495.htm","No"
"UNION EXPRESS LTD","32 WHARF ROAD APAPA LAGOS , 7 YUSFU SANUSI STREET OFF ADENRAN OGUNSANYA STREE SURULERE LAGOS, LAGOS, NIGERIA, 234","","","https://www.freightnet.com/profile/47541.htm","No"
"Jin Evershine Ent","13,osolo way Ajao Estste , lagos, Nigeria, +234","","","https://www.freightnet.com/profile/104984.htm","No"
"HEPHZIBAH LOGISTICS","SUILT 20 NACFA Complex ( M.A.K.I.A) KANO , KANO, KANO, 234","","","https://www.freightnet.com/profile/118221.htm","No"
"HEPHZIBAH LOGISTICS","SUILT 20 NACFA Complex ( M.A.K.I.A) KANO , KANO, KANO, 234","","","https://www.freightnet.com/profile/118220.htm","No"
"Arike Cargo Ventures","112 Cargo Complex , Ikeja, Lagos, 234","","","https://www.freightnet.com/profile/117898.htm","No"
"BTL World Shipping","23, Osolo way, Ajao Esate, Isolo, Lagos, 2341","","","https://www.freightnet.com/profile/56499.htm","No"
"SEA SANDS SHIPPING COMPANY LIMITED","1ST FLOOR, IAL PLACE 16 BURMA ROAD APAPA , SEA SANDS SHIPPING CO. LLC P.O. BOX: 42145, DUBAI,U.A.E., APAPA, LAGOS/NIGERIA, 234","","","https://www.freightnet.com/profile/110518.htm","No"
"Astute Partners Global Services Ltd","19, Musari Apena street, Beesam bus stop off Local-Int'l Airport Road, Lagos , Mafoluku Oshodi, Lagos State, Nigeria, 0001","","","https://www.freightnet.com/profile/107906.htm","No"
"maybell cargo minders","195 FAAN office complex MMA,ikeja lagos. , ANLCA secretariat,ikeja lagos, Alimosho, Lagos, 23401","","","https://www.freightnet.com/profile/114787.htm","No"
"Fastedge Global Logistics Ltd","48 Airport Road Mafoluku Oshodi , Oshodi, Lagos, 100261","","","https://www.freightnet.com/profile/116879.htm","No"
"Prudent Logistixs Nig. Ltd","18 Ezekiel Street, Off Toyin Street,, Ikeja, Lagos, 234 01","","","https://www.freightnet.com/profile/19487.htm","No"
"Eleclat Nigeria Limited","23, Osolo way, Ajao Estate. , NIL, Isolo, Lagos/Nigeria, 234-1","","","https://www.freightnet.com/profile/114686.htm","No"
"DEYEMI OMA NIG.LTD","Suite 240, Magnet Shopping Complex , 525 Agege Motor Rd, Ladipo Oshodi, Lagos, Lagos, 23401","","","https://www.freightnet.com/profile/114648.htm","No"
"Cotoaz Shipping & Logistics Limited.","13/15 Sapele Road Apapa , 13/15 Sapele Road Apapa, Apapa, Lagos, 101010","","","https://www.freightnet.com/profile/89707.htm","No"
"CONSTANT FREIGHT NIGERIA LIMITED","GEFFIN HOUSE,  PLOT 106/108 OSHODI-APAPA EXPRESS WAY, ASWANI BUS STOP, ISOLO, LAGOS, 2341","","","https://www.freightnet.com/profile/111834.htm","No"
