"name","address","phone","website","profileUrl","isPremiumMember"
"Peak River Logistics Limited","61 Marina Road ,Lagos, Nigeria , Lagos, Nigeria, 23401","","","https://www.freightnet.com/profile/86185.htm","No"
"Afo-Mascot Global limited","1B Oredola Olojo Street  , Off MM Airport Road , Beside Stop over motel, Ajao- Estate, Isolo, Lagos, 23","","","https://www.freightnet.com/profile/17312.htm","No"
"Libra Logistics Concepts Ltd","003b Nahco Complex,M/M/I/Airport,, Ikeja, Lagos/Nigeria, +234","","","https://www.freightnet.com/profile/108610.htm","No"
"Great Solag International Nigeria Ltd","28,Stella solanke stre off Intl Airport Road,Ajao Estate , Ajao Estate, Lagos\Nigeria, 234","","","https://www.freightnet.com/profile/114157.htm","No"
"DANITES VENTURES NIGERIA","NO11 UMUECHEM STREET , D/LINE, PORT HARCOURT, NIGERIA, +234","","","https://www.freightnet.com/profile/114059.htm","No"
"damdav eras inv. ltd","39, oduyemi street, anifowoshe, ikeja, lagos, nigeria, 234","","","https://www.freightnet.com/profile/112111.htm","No"
"EUREKA EXPRESS SERVICES NIG. LTD.","118B AWOLOWO WAY,IKEJA,LAGOS,NIGERIA , 14A SHINNA OGUNBAMBO ESTATE,OFF AGRIC ROAD,NEW-OKO OBA, ABATOIRE,AGEGE,LAGOS, IKEJA, NIGERIA, +234","","","https://www.freightnet.com/profile/112854.htm","No"
"Sudgerds Resources Limited","143 Aba Road  Nigeria , Port Harcourt, Nigeria, 234","","","https://www.freightnet.com/profile/112554.htm","No"
"ZAFO GLOBAL LINKS LTD","MIGFO HOUSE, 17 INTERNATION AIRPORT ROAD , AJAO ESTATE, ISOLO, ISOLO, LAGOS,","","","https://www.freightnet.com/profile/6524.htm","No"
"GONAMCARGO AGENCY LTD","11 SAMUEL STREET , LAGOS, NIGERIA, 234","","","https://www.freightnet.com/profile/83697.htm","No"
"Rashyshol Nig Ltd","1, Adeyemo Street off M/M Airport Rd, 7/8 B/Stop Mafoluku , Mafoluku, Oshodi, Lagos Nigeria, 23401","","","https://www.freightnet.com/profile/50221.htm","No"
"demidon freight & logistics","# 9 simbiat abiola road ikeja , ikeja, lagos nigeria, 234","","","https://www.freightnet.com/profile/109204.htm","No"
"Inland Freight Forwarders","290 Ikorodu rd , Anthony, Lagos, 23401","","","https://www.freightnet.com/profile/110021.htm","No"
"GREENDAY SERVICES LIMITED","4 Hse. B3 Bishop Oluwole Street, Victoria Island Lagos , victoria island, NIGERIA, 1234","","","https://www.freightnet.com/profile/54310.htm","No"
"ADMAIR AGENCIES NIGERIA LIMITED","No 1, ITAPEJU SREET APAPA LAGOS , ROOM 109 NAHCO COMPLEX MM/A AIRPORT LAGOS, IKEJA, LAGOS NIGERIA, +234","","","https://www.freightnet.com/profile/110960.htm","No"
"Islet Logistics Solutions LLC","12 Adeyemi Street,  Ebute Metta West, Mainland, Lagos, 2341","","","https://www.freightnet.com/profile/108225.htm","No"
"eafad ventures","14b ikolaba plaza,apapa-oshodi expressway,lagos nigeria. , lagos, lagos nigeria, 000176","","","https://www.freightnet.com/profile/105934.htm","No"
"AMARIS SHIPPINGAND MARITIME","33 CREEK ROAD , IBRU HOUSE APAPA , IKOTA SHOPPING COMPLEX LEKKI, APAPA, LAGOS, 234","","","https://www.freightnet.com/profile/110155.htm","No"
"Nellosun Nigeria Limited","No 10 Industrial Road, Trinity Bus-Stop, Olodi, Apapa, Lagos,Nigeria. , Lagos, Nigeria, 23401","","","https://www.freightnet.com/profile/103917.htm","No"
"Deyemi Oma Nig Ltd","525 Agege Motor Rd, Suite 240 Magnet Mall Ladipo Lagos , Lagos, Lagos, 23401","","","https://www.freightnet.com/profile/102721.htm","No"
"Regent Freight Limited","6 Ibezim Street, off Adelabu Street, Surulere, Lagos, 1234","","","https://www.freightnet.com/profile/24107.htm","No"
"OCEANPLUS INTL LOGISTICS LTD","SUITE 006 GROUND FLOOR NAHCO , COMPLEX M/M INTL AIRPORT, IKEJA, LAGOS/NIGERIA, 23401","","","https://www.freightnet.com/profile/61063.htm","No"
"Afripack Courier Services","34 Anifowoshe street , ikeja, lagos, 23401","","","https://www.freightnet.com/profile/109192.htm","No"
"MARK4 GLOBAL SERVICES LIMITED","MURTALA MUHAMMED AIRPORT, DOMESTIC WING, TERMINAL 2, IKEJA LAGOS  , IKEJA, LAGOS, NIGERIA, 23401","","","https://www.freightnet.com/profile/109268.htm","No"
"CARGOZEAL TECHNOLOGIES LTD","8/9 MUSA OYINBO STREET INTERNATIONAL AIRPORT ROAD MAFOLUKU LAGOS,NIGERIA. , IKEJA, LAGOS,NIGERIA, +23401","","","https://www.freightnet.com/profile/109015.htm","No"
"Mosam Logistics Services Limited","29, Airport Road, Ajao Estate , Lagos, Nigeria, +1234","","","https://www.freightnet.com/profile/56128.htm","No"
"INTERCONTINENTAL EXPRESS LOGISTICS SOLUTION LTD","Suite 337B (2nd Floor) Royal Assurance Plaza, Charity Bus-stop Oshodi, Lagos , Oshodi, Lagos, 2341","","","https://www.freightnet.com/profile/98465.htm","No"
"DUMANETH LIMITED","3 Alao Street, Off Rasmon Street, Off Osolo Way, Ajao Estate, Lagos, Nigeria , 14 Ifite Ukpo Street, Off Dr Faseun Avenue, Ago Palace Way, Okota- Isolo, Lagos, Nigeria, Lagos, Lagos, 1724","","","https://www.freightnet.com/profile/104587.htm","No"
"dabra freight limited","68,bornu crscent,apapa  , as above, lagos, nigeria, 234","","","https://www.freightnet.com/profile/89232.htm","No"
"Regent Freight LTD","68,WESTHERN AVENUE 3RD FLOOR UBA HOUSE,SURULERE LAGOS , 68,WESTHERN AVENUE 3RD FLOOR UBA HOUSE SURULERE,LAGOS, LAGOS, LAGOS,NIGERIA, +234","","","https://www.freightnet.com/profile/107513.htm","No"
"Result Investment Nigeria Limited","150 Ikorodu Road,Adebowale House, Onipanu, Lagos, Lagos, Nigeria, 23401","","","https://www.freightnet.com/profile/90465.htm","No"
"Nulab Investment Nig Ltd","Suit 319, Magnet Shopping Complex, 525, Agege Motor Road Oshodi Lagos, Lagos, Lagos/ Nigeria, 234","","","https://www.freightnet.com/profile/89223.htm","No"
"royal lhamkard nigeria enterprises ltd","20 oluaina str., isolo rd , 2 creek rd apapa lagos, lagos, lagos state nigeria, 234","","","https://www.freightnet.com/profile/106971.htm","No"
"SOLANIK NIGERIA LIMITED","537 AGEGE MOTOR ROAD, LADIPO BUS STOP. , SOGUNLE - OSHODI, LAGOS STATE,","","","https://www.freightnet.com/profile/51131.htm","No"
"Fast Freight Global Logistics Ltd","5 popoola street mafoluku oshodi , 5 popoola street mafoluku oshodi, oshodi, Lagos Nigeria, +23401","","","https://www.freightnet.com/profile/106550.htm","No"
"FAST TRAC SERVICES (UK) LTD","131, Innovation Centre, Mount Plea , Nigerian contact: 08033276818 James, Liverpool, Merseyside, L3 5TF","","","https://www.freightnet.com/profile/95899.htm","No"
"meadows wye nig","33, osolo way off ajao estate , lagos, ogun state, 123","","","https://www.freightnet.com/profile/50281.htm","No"
"Iyatasarauniya Production Nig.Ltd","No.15 Ahmad Bello Way Ningi Towwn , No.50 M.Harri House Gombe, Ningi, Bauchi, 009","","","https://www.freightnet.com/profile/105985.htm","No"
"zeniv nigeira enterprise","10 SOLO OGUN STREET , AGUDA, LAGOS, LAGOS STATE, 234-01","","","https://www.freightnet.com/profile/92772.htm","No"
"HONEYSLYMAN INTERNATIONAL LOGISTICS LIMITED","195 FAAN OFFICE NAHCO COMPLEX MMIA,IKEJA LAGOS STATE , 10 ILASAMAJA ROAD OFF ALAFIA BUS STOP MUSHIN LAGOS STATE, IKEJA, LAGOS/NIGERIA, 23401","","","https://www.freightnet.com/profile/105289.htm","No"
"Bolijay Shipping Services Limited","48, Calcutta Crescent, Apapa, Lagos - Nigeria , N/A, Apapa, Lagos - Nigeria, 101010","","","https://www.freightnet.com/profile/84515.htm","No"
"imhokad nigeria limited","1 rumuola road beside everyday supper market @ laommies,rivers state port harcourt , 6 onwukwe close off station road elelenwo,rivers state port harcourt, port harcourt, rivers state nigeria, +234","","","https://www.freightnet.com/profile/88664.htm","No"
"Holy Royal Cargo Logistics","27,Nahco Complex MMIA Lagos, Nigeria , 7, Amingo close Ajao Estate Off International Airport Road Lagos Nigeria, Ikeja, Lagos, 01","","","https://www.freightnet.com/profile/100770.htm","No"
"Alzayyad Concept Limited","3, Awoniyi Elomo Street , Off Muritala Mohammed International Airport, Isolo, Lagos, 2341","","","https://www.freightnet.com/profile/60142.htm","No"
"EAGLE FREIGHTS & LOGISTICS","8,Joy Avenue off international Airport Road ,Ikeja ,Lagos , 8 joy Avenue off international Airport road ,Ikeja,Lagos, Ikeja, LAGOS /NIGERIA, 234-","","","https://www.freightnet.com/profile/103367.htm","No"
"Goldengate Investments Limited","2a, Osolo way, off M/M airport road, ajao estate , Isolo, Lagos,","","","https://www.freightnet.com/profile/6021.htm","No"
"Ofanegz Tech Limited","NAHCO Export Complex, Murtala Muhammed International Airport, Ikeja, Lagos, 2341","","","https://www.freightnet.com/profile/103619.htm","No"
"clearing and forwarding","no124nahco complex nahco airport , no4 adekunle st mafoluku oshodi, oshodi, lagos nigeria, 234","","","https://www.freightnet.com/profile/104474.htm","No"
"CONFIDENCE CARGO LIMITED","7, ADEOLA AJAYI CRESCENT, AVAIATION ESTATE OFF M/M INT'L AIRPORT , LAGOS, LAGOS, NIGERIA, 23401","","","https://www.freightnet.com/profile/89930.htm","No"
"bettymor enterprises limited","120 DSC road  , warri, delta, 234","","","https://www.freightnet.com/profile/103819.htm","No"
"smithhung logistic ltd","5 ANTHONY OBE ST OSHODI , 670 OSHODI EXPRESS ROAD, OSHODI, LAGOS, 23401","","","https://www.freightnet.com/profile/103421.htm","No"
"Transoceanic Logistics Limited","22A Rafiu Shittu Street, Alaka Estate Surulere, Surulere, Lagos/Nigeria, 23401","","","https://www.freightnet.com/profile/98735.htm","No"
"SOLO CAP LOGISTICS LIMITED","SUITE T7 NAHCO COMPLEX  , M/M AIRPORD ROAD, IKEJA, LAGOS, 23401","","","https://www.freightnet.com/profile/49743.htm","No"
"JULIUS WALES NIG LTD","1 NNnpc Road Egbe Road Orilowo Ejigbo , 1 NNpc road egbe road orilowo Ejigbo, Lagos, Nigeria, 2341","","","https://www.freightnet.com/profile/99152.htm","No"
"Skynetfas cargo agency","Nahco complex , M/M international airport, Lagos, Lagos / Nigeria, 23401","","","https://www.freightnet.com/profile/59891.htm","No"
"Mouth And Wisdom Logistics","13C, Commercial Road,  2nd Floor, Right Wing, Apapa , Lagos, Lagos, Nigeria, NG 234","","","https://www.freightnet.com/profile/87815.htm","No"
"DAILY ADVERTIZER NIGERIA LIMITED","1 FAITH IN CHRIST STR  , ILEAJA, LAGOS, LAGOS, 2341","","","https://www.freightnet.com/profile/101456.htm","No"
"Abtech Logistics Limited","20,Talabi Street Idi-Mangoro Agege Lagos , 21,Uwagboe Street Ipaja Road Baruwa Estate, Agege, Nigerian, +234","","","https://www.freightnet.com/profile/90912.htm","No"
"Musa O. Taofeek & Associates","10, Akinyemi Court, By Oshodi Street , Epetedo Area, Lagos Island,","","","https://www.freightnet.com/profile/22925.htm","No"
"Design Cargo","2 Martins Street , Off Broad Street, Bristol Hotel Building, Lagos, Lagos,","","","https://www.freightnet.com/profile/6930.htm","No"
"Value Foods","50 Lagos Street by Niger , Umuahia, Nigeria, 440233","","","https://www.freightnet.com/profile/100348.htm","No"
"new hope cargos limited","29, alabe street, off, osolo ways , isolo, lagos, nigeria, isolo, lagos, lagos, nigeria, 23401","","","https://www.freightnet.com/profile/99727.htm","No"
"chubiyo global ltd","Nnamdi azikiwe international airport Abuja, Nigeria , Virgo block elenganza plaza apapa Lagos, Nigeria, Abuja ,Lagos, Port-harcourt, FCT ABUJA, LAGOS STATE, RIVER STATE, 1235","","","https://www.freightnet.com/profile/87476.htm","No"
"FLOWTIDE OIL AND MARITIME SERVICES NIG.LTD.","8 Prefab close GRA 3 Briggs Estate , Port Harcourt, Nigeria, 500271","","","https://www.freightnet.com/profile/99038.htm","No"
"jamah cargo and logisitcs","14/16 osolo way ajao estate , ikeja, lagos, 234","","","https://www.freightnet.com/profile/98549.htm","No"
"LADWHEELS VENTURES LIMITED","GF 14 AXIOM PLAZA BESIDES CONOIL OPP NITEL , AGEGE, LAGOS, 23401","","","https://www.freightnet.com/profile/99883.htm","No"
"Fred Express Forwarders","32 Eniola Adesanya str, Mafuluku Oshodi , Ikeja, Lagos/Nigeria, +234","","","https://www.freightnet.com/profile/99371.htm","No"
"gosheenxpress service","ground floor nahco cargo building, m m airport  ikeja lagos , groud floor nahco cargo building,m m airport ikeja lagos, lagos, nigeria, +234","","","https://www.freightnet.com/profile/90717.htm","No"
"CSO Tecnologies Ltd","!st Avenue 11 Road, plot 60,, Festac Town, Lagos, 23401","","","https://www.freightnet.com/profile/52930.htm","No"
"SOUTHPORT NIGERIA LTD","5B, IBIKUNLE AKINTOYE STREET , APAPA, LAGOS NIGERIA, 234","","","https://www.freightnet.com/profile/98126.htm","No"
"EAST ATLANTIC MARITIME CO. LTD","NO. 1 CHIOKWA STR, OGBUNABLI , NO. 1 CHIOKWA STR, OGBUNABLI, PORT HARCOURT, NIGERIA, 234","","","https://www.freightnet.com/profile/98828.htm","No"
"Okanlawan Logistics Cargo Limited","02, Ogunyinka Street, Along International Airport Raod, Ikeja Lagos. , 20, Olaore Street, Mafoluku Oshodi, Lagos, Lagos, Lagos State, 101001","","","https://www.freightnet.com/profile/94050.htm","No"
"Sunny wealth limited","4/6, 'Dupe street Opeki Ipaja, Same as above, Ipaja, Lagos, 234","","","https://www.freightnet.com/profile/96527.htm","No"
"Kaymide Integrated Services Limited","50 mushin road , Near Texaco filling station, Isolo, Lagos state, 23401","","","https://www.freightnet.com/profile/45021.htm","No"
"Koljen International Ltd","Nacho building complex , 1st floor,M.M.Airport, ikeja, lagos/Nigeria, +234","","","https://www.freightnet.com/profile/83279.htm","No"
"EZAKAANDSONSGLOBAL NIG. LTD","47 IDUMOTA AV.MOTULA MOHAMED AIRPORT,LAGOS STATE. , 39 ENUGU ROAD 9TH MILE,ENUGU STATE., 9TH MILE, ENUGU STATE IN NIGERIA, +234","","","https://www.freightnet.com/profile/97324.htm","No"
"unilog freight & logistics ltd.","35, itapeju apapa, Lagos  , Apapa, Lagos Nigeria, +234","","","https://www.freightnet.com/profile/97323.htm","No"
"xyfreight","43 Osolo Way, Ajao Estate, Lagos, Nigeria, 2341","","","https://www.freightnet.com/profile/97153.htm","No"
"2s2f ventures","16 & 18 borokini street, aga, ikorodu, lagos state. , ikorodu, lagos, nigeria, 104211","","","https://www.freightnet.com/profile/96964.htm","No"
"m rash","borokini , aga, ikorodu, lagos state, +234","","","https://www.freightnet.com/profile/94282.htm","No"
"Obichukwu Enterprises Limited","N.P.A Agency Building Suite 12, Tincan Island Port Apapa-Lagos. , Apapa, Lagos, NA","","","https://www.freightnet.com/profile/96905.htm","No"
"ANDIFONMMI SHIPPING & LOGISTICS LIMITED","14, Ola Adeshile Street, Off Gogo Hassan Avenue, Ajao EState, Lagos , Lagos, Lagos, 23401","","","https://www.freightnet.com/profile/63725.htm","No"
"Versal Cargo And Logistics Limited","Suite 1 Nahco Export Building , M M Airport, Ikeja, Lagos, 23401","","","https://www.freightnet.com/profile/22932.htm","No"
"2s2f ventures","16 & 18 borokini street, aga, ikorodu, lagos state. , ikorodu, lagos, nigeria, 104211","","","https://www.freightnet.com/profile/96586.htm","No"
"S NOMA & company","KM 6 Benin Sapela Road , Edo State, Nigeria, 1751","","","https://www.freightnet.com/profile/95802.htm","No"
"Multi Grace Logistics Services ltd","Suit 104, Nahco Faan Complex, Muritala Muhammed Int. Airport , Ikeja, Lagos, 23401","","","https://www.freightnet.com/profile/61799.htm","No"
"action freight international limited","35, association avenue ilupeju lagos, nigeria , same as above, lagos, nigeria, 234","","","https://www.freightnet.com/profile/88494.htm","No"
"GOLD ATLANTIC  VENTURES","14  ADEGBOLA STR ANIFOWOSE  , 19, ASSOLAND BEESAM, IKEJA, LAGOS, 23401","","","https://www.freightnet.com/profile/95247.htm","No"
"Best Synergy Ltd","31 Commercial Road,, Apapa, Lagos, Nigeria,","","","https://www.freightnet.com/profile/64641.htm","No"
"Caltruth Ventures Limited","19, Assoland Street, Off Beesam Street, Ikeja, Lagos, 23401","","","https://www.freightnet.com/profile/49530.htm","No"
"amstond fast cargo limited","211 nahco complex mma intl airport lagos nigeria , 5,adedoyin close iyana ipaja lagos state, ikeja, lagos nigeria, 23401","","","https://www.freightnet.com/profile/47881.htm","No"
"Jay Tepol Global Logistic","54,hajj camp,complex airport road , 25 shobowale street ilasa lagos, mushin, lagos, +23401","","","https://www.freightnet.com/profile/50722.htm","No"
"wealthstride investment ltd","20 lre akari estate road lsolo lagos , same, lsolo, lagos nigeria, 0001","","","https://www.freightnet.com/profile/45964.htm","No"
"Akannic Logistics Limited","6&8 AGBEKE ADESOKAN CLOSE, OBADEYI BUS-STOP IJAIYE  OJOKORO , LAGOS, NIGERIA, 23401","","","https://www.freightnet.com/profile/91081.htm","No"
"Value Handlers","1st Floor, Nahco/ Hajj Camp Complex, MMI Airport, Lagos, Lagos, 234","","","https://www.freightnet.com/profile/91351.htm","No"
"CARDINAL POINT CARGO SERVICES LTD.","19/21ADEOLA OYE STREET , IKEJA, NIGERIA,","","","https://www.freightnet.com/profile/52595.htm","No"
"DIAMOND AIR GLOBAL SERVICES LTD","3, Aina Close Bariga Lagos , 3, Aina Close Bariga Lagos, lagos, Nigeria, 234","","","https://www.freightnet.com/profile/92686.htm","No"
"Sahim Investment Company Limited","5/7, Alhaji Rafiu  Street , Off Muritala Muhammed Airport Road, Oshodi, Lagos, +24301","","","https://www.freightnet.com/profile/85015.htm","No"
"Bostmik International Company Ltd","7, Somoye Osundairo Street, Off Ola  Ayeni Street , P O BOX 15342, IKEJA-LAGOS,","","","https://www.freightnet.com/profile/6188.htm","No"
"Easylink Integrated Logistics Ltd","Suite: C 18/06, Nigerian Army Shopping Arena, Agege Motor Road, Bolade, Oshodi, Lagos, Nigeria, 23401","","","https://www.freightnet.com/profile/92072.htm","No"
"Roseben Associates Nig Ltd","Suite 52, 1st floor, 36/40 Old Ojo Road, Maza-Maza First Gate, Lagos, Lagos- Nigeria, 1001100","","","https://www.freightnet.com/profile/91882.htm","No"
"GREEN STAR LINE LIMITED","SUITE 304,525 AGEGE MOTOR ROAD , LADIPO,OSHODI, LAGOS - STATE, 23401","","","https://www.freightnet.com/profile/54869.htm","No"
"CEDAR GLOBAL LOGISTICS SERVICES","3, fadiya street off demurin road ketu lagos , 11, Adeyemo street off 7&8 bustop ajao estate along muritala muhammed int'l airport road logos., ikeja, lagos, 01234","","","https://www.freightnet.com/profile/91777.htm","No"
"kakaki investment limited","46, burma road, apapa. lagos , 641 cavera festac town 6th avenues, festac town, nigeria, 234","","","https://www.freightnet.com/profile/88823.htm","No"
"Bennosky International Services Limited","1B Olabode Afariogun Street, off Murtala Muhammed International Airport Road, Isolo, Lagos, 2341","","","https://www.freightnet.com/profile/91563.htm","No"
"Chricel Logistics Limited","75, Airport Road, Igwuruta-Ali,Ikwerre L.G.A.,, Port Harcourt, Rivers State - Nigeria, 50001","","","https://www.freightnet.com/profile/91581.htm","No"
"Aviomarine Transport Agencies Ltd.","Cargo Room , Nnamdi Azikiwe International Airport, Abuja,","","","https://www.freightnet.com/profile/5775.htm","No"
"Cargo Zeal Technologies Limited","30, Murtala Muhammed International Airport Road , Gbagura House, 7/8 Bus Stop, Opposite Ajao Estate, Mafoluku, Oshodi, Lagos,","","","https://www.freightnet.com/profile/21337.htm","No"
"INTERCONTINENTAL EXPRESS LOGISTIC SOLUTION LTD","337b Royal exchange Plaza , Charityb/stop Oshodi, Lagos, Lagos,Nigeria, 2341","","","https://www.freightnet.com/profile/90894.htm","No"
"CityConnectionfreightcargoagency Nig Ltd","48 Murtala Muhammed International Airport Road Ajao estate Lagos , 21 Olowore Street Mafoluku Oshodi Lagos, Osolo, Lagos State, 234","","","https://www.freightnet.com/profile/90230.htm","No"
"PROFESSIONAL SHIPPING LTD","7, Dapo Shokeye close, Ire - Akari Estate, Lagos , Lagos, Lagos, 23401","","","https://www.freightnet.com/profile/83421.htm","No"
"Sahim Investment CompanyLimited","5/7, Alhaji Rafiu Street, Murtala Muhammed International Airport Road, Oshodi-Isolo, Lagos, 23401","","","https://www.freightnet.com/profile/90190.htm","No"
"TSH UNIVERSAL CARGO LOGISTICS LIMITED","10,OSIFILA STREET,ANIFOWOSE IKEJA. , 16,ABA ROAD OKPORO ROAD RUMUOGBA PORT RUMUOGBA PORT HARCOURT., IKEJA, IKEJA, 23401","","","https://www.freightnet.com/profile/58946.htm","No"
"broaden global international logistics limited","wing b, 2nd floor , nahco complex, ikeja, lagos/nigeria, 23401","","","https://www.freightnet.com/profile/89357.htm","No"
"Supreme Logistics & Energy Services Nigeria Limited","Plot 3560, Lakeview Estate Phase 1, Amuwo Odofin GRA, Lagos, Lagos, Nigeria, NG","","","https://www.freightnet.com/profile/87883.htm","No"
"Vilen Worldwide Freight Limited","Ekwu Awolo House; 43, Osolo way, off Murtala Muhammed International Airport Road, Isolo, Lagos, 2341","","","https://www.freightnet.com/profile/55300.htm","No"
"Mouth And Wisdom Logistics","13C, Commercial Road, Apapa, Lagos , Lagos, Lagos, Nigeria, 2345","","","https://www.freightnet.com/profile/88454.htm","No"
"T.S INTERNATIONAL COMPANY","52,shonola street,ogba,ikeja,lagos,nigeria , 21,idowu street,karaole estate,ifako,ogba,lagos,nigerai, lagos, lagos, p.o box 332","","","https://www.freightnet.com/profile/88403.htm","No"
"Raypaker International Limited","No 9, Ichegbo Street Rumuigbo PHC, Nigeria. , Port Harcourt, Rivers, Nigeria, +234","","","https://www.freightnet.com/profile/88283.htm","No"
"Westend int'l logistics service limited","11,ogundana str,off allen avenue,ikeja,lagos. , Ikeja, Lagos,Nigeria, +234","","","https://www.freightnet.com/profile/58355.htm","No"
"Christos International Cargo","20,Talabi Street Mangoro Agege Lagos State , 21,Unwagboe Street Baruwa Bus-stop Off Ipaja rd, Agege, Lagos/Nigeria, +234","","","https://www.freightnet.com/profile/84484.htm","No"
"skyrace aviation logistics limited","9, james okiki street oko oba agege lagos lagos , ground floor, nahco cago complex murtala muhamed international airport, lagos, lagos, Nigeria, 1234","","","https://www.freightnet.com/profile/83907.htm","No"
"daudeen freight forwarding company limited","suite 351/352b, royal exchange plaza, charity, oshodi, lagos , 93, tombia extension, GRA by mandela car wash, portharcourt, Lagos, Nigeria, 23401","","","https://www.freightnet.com/profile/87205.htm","No"
"Merciful International Nig Limited","Libra Blk 2nd, Floor , Eleganza Plaza,Commercial Road Apapa, Lagos, Nigeria, +234","","","https://www.freightnet.com/profile/86767.htm","No"
"Continental Freight & Logistics Limited","99 Awolowo Way, 3rd Floor, Suite 21b , Balogun, Ikeja, Lagos,","","","https://www.freightnet.com/profile/4985.htm","No"
"Christek Global Ventures","M.M Int\'l Airport Nahco,Cargo Village Nahco,Ikeja -Lagos ,Nigeria , 58 Oworo Road,Oworonshoki,Lagos-Nigeria, Ogwashi Uku, Lagos State,Nigeria, 234","","","https://www.freightnet.com/profile/56908.htm","No"
"witley associates ltd","12, idowu street, off awolowo way , ikeja -lagos, lagos state . nigeria, 2341","","","https://www.freightnet.com/profile/48029.htm","No"
"Diamondworth Global Associates Limited","11, Kaara Street, off Osolo way , Isolo, Lagos, 234","","","https://www.freightnet.com/profile/45985.htm","No"
"survival agency nig ltd","48,muri tala muhamed international airport road,mofoluku junction,oshodi , oshodi, lagos/nigeria, 23456","","","https://www.freightnet.com/profile/86705.htm","No"
"Oguson motors","Esso enugu , Depot enugu, Enugu, Nigeria, 213","","","https://www.freightnet.com/profile/86619.htm","No"
"Acesworld Amplified Limited","44 Ladipo Bateye stree , GRA, ikeja, Ikeja, Lagos, 001","","","https://www.freightnet.com/profile/86230.htm","No"
"S&K LOGISTICS LIMITED","SUITE 12 NACHO COMPLEX , AIRPORT LAGOS NIGERIA, IKEJA, LAGOS, 23401","","","https://www.freightnet.com/profile/61852.htm","No"
"SUNTOB TRUST NIG. LTD","No. 99, Obafemi Awolowo Way, Ikeja, Lagos, Nigeria , Ikeja, Lagos, 234","","","https://www.freightnet.com/profile/64393.htm","No"
"Kolawuyi nigeria limited","Suite 36 container complex Tincan Island, Apapa Lagos , 11 bola adegboro alapere ketu, Lagos, Lagos, Lagos/nigeria, +234","","","https://www.freightnet.com/profile/52702.htm","No"
"GOCHY NIG ENT LTD","16 DANIEL CLOSE ALAGBADO , LAGOS, NIGERIA, +23480","","","https://www.freightnet.com/profile/85443.htm","No"
"Sahim Investment Nigeria Limited","50 Afariogun Street , Off Charity Bus Stop, Oshodi, Lagos,","","","https://www.freightnet.com/profile/22416.htm","No"
"RIEF CREST INTERNATIONAL LIMITED","NO 2 IPAJA ROAD AGEGE , LAGOS STATE , IN CALABER, IKEJA, LAGOS , NIGERIA, 1234","","","https://www.freightnet.com/profile/84896.htm","No"
"Delight Trade Agencies","NAHCO COMPLEX,MM2 INTERNATIONAL AIRPORT,IKEJA LAGOS NIGERIA , IKEJA, LAGOS, 234","","","https://www.freightnet.com/profile/84872.htm","No"
"Annoquick Nigeria Limited","4 Egelege Street Off Olu-Obasanjo Road , D/Line, Port Harcourt, Rivers, 7612","","","https://www.freightnet.com/profile/22989.htm","No"
"fantastic logistic company","23 muritala muhamend airport road mafoluku shodi lagos nigeria , 23 muritala muhamend airport road mafoluku shodi lagos nigeria, lagos, lagos, 23401","","","https://www.freightnet.com/profile/53201.htm","No"
"Goldseal Transactions Ltd","7A Adeola Ajayi Crescent  , Mafoloku, Lagos/Nigeria, 1234","","","https://www.freightnet.com/profile/83016.htm","No"
"psalmmy freight logistics","14 wilkey street off makinde idioro mushin lagos , 16 oyegbola street off onipan ikorodu road lagos, mushin city, lagos state, +234","","","https://www.freightnet.com/profile/58625.htm","No"
"Ozobros International Agencies  Ltd","Suite 250b, Royal Exchange Plaza  , Charity Bus Stop, Mile 2 Expressway Oshodi, Lagos,","","","https://www.freightnet.com/profile/21423.htm","No"
"FAST DELIVERY LOGISTICS","6/7 NAHCO COMPLEX M/M  , 6/7 NAHCO COMPLEX M/M, AIRPORT IKEJA, LAGOS NIGERIA, 23401","","","https://www.freightnet.com/profile/82738.htm","No"
"SPA GLOBAL LINK VENTURES","27,M/M International Airport Road , Isolo, Lagos Nigeria, 2341","","","https://www.freightnet.com/profile/50826.htm","No"
"CFS Logistics Services Ltd","22, Ogunyinka Street, Mafoluku , Oshodi, Murtala Mohammed International Airport Road, Ikeja, Lagos, 2341","","","https://www.freightnet.com/profile/52127.htm","No"
"Megacarecargo","muritala mohammed inter,l airport ikeja lagos , ikeja, Lagos,Nigeria, 102031","","","https://www.freightnet.com/profile/49381.htm","No"
