"name","address","phone","website","profileUrl","isPremiumMember"
"PLUSPERU CONSORCIO LOGISTICO","AV SAN LUIS 2025 OF. 306 SAN BORJA , LIMA, LIMA, LIMA 41","","","https://www.freightnet.com/profile/115454.htm","No"
"Union South International SAC","Av. Elmer Faucett 1743 , Bellavista, Callao, Peru, 02","","","https://www.freightnet.com/profile/117489.htm","No"
"C&M INTERNATIONAL FREIGHT SAC","AV. AREQUIPA 330 OF.802 , LIMA, PERU, LIMA 1","","","https://www.freightnet.com/profile/118479.htm","No"
"J & R GLOBAL LOGISTIC SAC.","Av. Bertello Mz. I Lte. 16 A.V. San Remo II – San Martín de Porres. , SAN MARTIN DE PORRES, LIMA, 051","","","https://www.freightnet.com/profile/127960.htm","No"
"NOVOTRANS LOGISTICA Y CARGA SAC","CALLE CAROLINA FREYRE 149 URB.PANDO IV ETAPA SAN MIGUEL , CENTRAL, SAN MIGUEL - LIMA -PERU, 51132","","","https://www.freightnet.com/profile/133997.htm","No"