"name","address","phone","website","profileUrl","isPremiumMember"
"O.C. Sun-Thee","Bornheide 10B , Hamburg, Hamburg, 22549","","","https://www.freightnet.com/profile/203099.htm","No"
"Arm-g International Logistics, Inc. Davao","Door 2 Gims Bldg, No.48, Lacson Street, Bo. Obrero , Davao City, Davao Del Sur, 8000","","","https://www.freightnet.com/profile/162169.htm","No"
"ARM-G International Logistics, Inc.","Unit 201, 204 &  210, The Manila Residences Tower 1 , 2320 Taft Ave., Malate, Manila, 1004","","","https://www.freightnet.com/profile/158790.htm","No"
"RME Courier and Business Center","G/F QCRB Tower Rizal St. , Barangay V, Quezon, Philippines, 4301","","","https://www.freightnet.com/profile/149087.htm","No"
"BITRACS CARGO SERVICES","Unit 31 D3YG10 Building , St. Anthony, Angliongto (Damosa Mamay) Road, Lanang, Davao City, davao del sur, 8000","","","https://www.freightnet.com/profile/60524.htm","No"