"name","address","phone","website","profileUrl","isPremiumMember"
"Orient Express Forwarding Pte Ltd","705 SIMS DRIVE #01-05, SHUN LI INDUSTRIAL COMPLEX, SINGAPORE, SINGAPORE, 387384","96363923","http://www.orientexpressforwarding.com.sg/","https://www.freightnet.com/profile/247035.htm","Yes"
"LABGISTICS ASIA PTE. LTD.","Labgistics Asia Pte Ltd 76 Pioneer Road, #03-04/05, Mapletree Pioneer Logistics Hub , Singapore, Singapore, 639577","","","https://www.freightnet.com/profile/259670.htm","No"
"DEL ENTERPRISE PTE LTD","21 Pandan Ave #05-08, Singapore 609388 , Singapore, SINGAPORE, 609388","","","https://www.freightnet.com/profile/175514.htm","No"
"HongLi International Pte Ltd","63@Ubi, Ubi Avenue 1 #04-01,  Singapore 408937 , Singapore, Singapore, 408937","","","https://www.freightnet.com/profile/148065.htm","No"
"TSR LOGISTICS PTE LTD","NO 10, ANSON ROAD, #27-04, S 079903 , SINGAPORE, SINGAPORE, 079903","","","https://www.freightnet.com/profile/138399.htm","No"
"M.C.Packaging Pte Ltd","159 Gul Circle , Jurong Town, Singapore, 629617","","","https://www.freightnet.com/profile/118559.htm","No"
"CYC Logistics Pte Ltd","5 Marsiling Industrial Estate , Road 3 #01-53, Singapore, Singapore, 739251","","","https://www.freightnet.com/profile/81751.htm","No"