"name","address","phone","website","profileUrl","isPremiumMember"
"Guka logistics international limited","Equatorial shopping mall level 1 , Kampala, Kampala central, 256","+256773164506","https://www.gukalogistics.com/","https://www.freightnet.com/profile/230398.htm","Yes"
"KASO LOGISTICS LTD","Kampala, Entebbe, Nakawa, Kampala, 256","+256702088830","http://www.kasologistics.com/","https://www.freightnet.com/profile/256730.htm","Yes"
"Kaps Impex Limited","Plot 37/39, Kimera Road, Ntinda Kampala, Kampala, +256","+256702 844227.","http://www.kapsimpex.com/","https://www.freightnet.com/profile/128910.htm","Yes"
"EXIM FREIGHT SMC LIMITED","Plot 15, Mbuya Road Kinawataka, Richflo House, Suite 002. , Kampala, Uganda, 256","","","https://www.freightnet.com/profile/230430.htm","No"
"DTS Global Logistics LTD","Mirage complex, Frist floor, suite no: MC1-05B , Kampala, Kampala, t","","","https://www.freightnet.com/profile/263330.htm","No"
"ABC SEA AND AIR LOGISTICS","PO BOX 2824 , KAMPALA, UGANDA, +256","","","https://www.freightnet.com/profile/226000.htm","No"
"Ice Logistics Limited","Rubaga, Nabunya Road  , Plot 12, Kampala, Central, 36126","","","https://www.freightnet.com/profile/264461.htm","No"
"TRIDENT FREIGHT LIMITED","Becky House, Ground Floor, Room 1 , Lubowa, Entebbe Road, Kampala, Wakiso, 10401","","","https://www.freightnet.com/profile/257727.htm","No"
"HEY Transport Limited","Unit 16G, Intex Road, Naalya Estate , Kampala, Kampala, Central Region, 256","","","https://www.freightnet.com/profile/159137.htm","No"
"TOPHER LOGISTICS LIMITED","Kampala  , Malaba, Kireka, kira, 256","","","https://www.freightnet.com/profile/175217.htm","No"
"FAST LOGISTICS CARGO","6TH FLOOR,DIAMOND TRUST BUILDING,KAMPALA ROAD,KAMPALA,UGANDA , KAMPALA, Kampala, +256","","","https://www.freightnet.com/profile/95964.htm","No"
"Multi-Bulk Forwarders Ltd","UGANDA COOPREATIVE ALLIANCE BUILDING , NKRUMAH ROAD , PLOT 447/49, KAMPALA, UGANDA, N/A","","","https://www.freightnet.com/profile/171578.htm","No"
"Payload Cargo","Old Butabika Road Ggaba , Suite 14, Kampala, Uganda, 256","","","https://www.freightnet.com/profile/258229.htm","No"
"SHET AND PALIA LOGISTICS","Entebbe-Cargo terminal , Entebbe, Entebbe, 0000","","","https://www.freightnet.com/profile/250337.htm","No"
"Districargo forwarders limited","OLD PORTBELL ROAD , KAMPALA, NAKAWA, TO24","","","https://www.freightnet.com/profile/257038.htm","No"
"MARITIME SHIPPING CO LTD","Kampala Road , Ambassodor house, Kampala City, Uganda, 33865","","","https://www.freightnet.com/profile/240390.htm","No"
"ECU WORLDWIDE UGANDA LIMITED","NAKAWA BUSINESS PARK , BLOCK B, 3RD FLOOR, KAMPALA, Uganda, 10318","","","https://www.freightnet.com/profile/253629.htm","No"
"Alaca Clearing and Forwarding Limited","Sofia Lane , Busia, Uganda, 0006","","","https://www.freightnet.com/profile/230862.htm","No"
"UniCargo Forwarders Limited","Opp Mutaasa City Kasangati, Off Gayaza Road , Kasangati, Kasangati, 3994","","","https://www.freightnet.com/profile/227467.htm","No"
"Tripple JS logistics LTD","MTAC BLOCK JINJA RD NAKAWA , Kampala, Uganda, 28568","","","https://www.freightnet.com/profile/154064.htm","No"
"Worldwide Logistics Ltd","Plot 20, P.O.Box 6039 , Kanjokya Street, Kampala,","","","https://www.freightnet.com/profile/22041.htm","No"
"Quick Task Freight Ltd","Bukoto - Kisaasi Road , Kampala, Kawempe Division, 188 Malaba- Uganda","","","https://www.freightnet.com/profile/235713.htm","No"
"Gatek Consult Uganda Limited","MUBS Small Gate, URA Road exit , PO Box 110520, Kampala, Kampala/Uganda, 10318","","","https://www.freightnet.com/profile/229426.htm","No"
"GLANCE ROADWAYS","NORTHPARK PLAZA , LEVEL 2, SUITE 2, kampala, bweyogerere,kampala, 556","","","https://www.freightnet.com/profile/229363.htm","No"
"INDUS LOGISTICS UGANDA LIMITED","KAMPALA , KAMPALA, UGANDA, +256","","","https://www.freightnet.com/profile/182732.htm","No"
"Abundance Logistics Limited","Plot 1 Kimera Road , Ntinda, Kampala, Ntinda, 256","","","https://www.freightnet.com/profile/209631.htm","No"
"Laiken Logistics LTD","Plot 58 Kampala Road , Mabirizi Complex, Level 7, Suit 43, ,","","","https://www.freightnet.com/profile/210660.htm","No"
"Inter-Cargo Agencies (U) Ltd","Entebbe International Airport, Cargo Terminal Building room 60, P O Box 949, Entebbe,","","","https://www.freightnet.com/profile/17579.htm","No"
"PACIFIC LINES LIMITED","Plot 1, Portal Avenue, Span House, Suite 211. Box # 5171 Kampala. , Plot 1, Portal Avenue, Span House, Suite 211. Box # 5171 Kampala,(E.A), Kampala, Uganda, +256","","","https://www.freightnet.com/profile/116531.htm","No"
"Tehillah trading and logistics","Bombo road annext SA building, ground floor, B12 , Kampala, Central, 00256","","","https://www.freightnet.com/profile/218343.htm","No"
"PACIFIC LINES LIMITED","Plot 1, Portal Avenue, Span House, Suite 211.  P.O.Box 5171 Kampala, Uganda (E.A) , Tel: +256 772 113 112 Mobile: +256 752 322 755, KAMPALA, Kampala District, +256 p.o.box 5171","","","https://www.freightnet.com/profile/208442.htm","No"
"GGAYI LOGISTICS LIMITED","Ground Floor, George Courts , Plot 34 Hannington Road, Kampala, Central Kampala, P.O Box 8251, Kampala","","","https://www.freightnet.com/profile/154500.htm","No"
"DELMAS LOGISTICS SOLUTIONS LIMITED","NAKAWA KINAWATAKA ROAD , RICHFLO BUILDING, NAKAWA, NAKAWA UGANDA, PO BOX 200369 NAKAWA KAMPALA","","","https://www.freightnet.com/profile/214840.htm","No"
"PSJ CLEARING AND FORWARDING CO.LTD","KAMPALA/UGANDA , AKAMWESI 2ND FLOOR RM 10A, KAMPALA CITY, KAMPALA CITY, P.O BOX 40265","","","https://www.freightnet.com/profile/171661.htm","No"
"DAT Freights","kamplaa , Ntinda Shopping Complex, Ntinda Tranding Center, Nakawa, 4188","","","https://www.freightnet.com/profile/182627.htm","No"
"Philda Freight Ltd","Ambassador House , Kampala, uganda, 256","","","https://www.freightnet.com/profile/190835.htm","No"
"Sovan Enterprises Limited","Suit 1 Cargo Terminal Entebbe International Airport , Kampala, Uganda, 256","","","https://www.freightnet.com/profile/175831.htm","No"
"Roncy Enterprise","Najim Mall Ntinda , P. O Box 8 Kampala, Kampala, Uganda, 00256","","","https://www.freightnet.com/profile/169469.htm","No"
"Trueline Africa Limited","3rd Floor Nakawa House , Nakawa Business Park, Kampala, Uganda, 256","","","https://www.freightnet.com/profile/160606.htm","No"
"SHIPAX AFRICA LIMITED","OPPOSITE GLOBAL PAINTS KIREKA , KAMPALA, KAMPALA, +256","","","https://www.freightnet.com/profile/172367.htm","No"
"Mates Forwaders Limited","PO BOX 40252 MOMBASA , Mombasa, Kenya, 80110","","","https://www.freightnet.com/profile/159663.htm","No"
"Maritime Shipping Company","Ambassodor House Kampala Road , Suite Number: B07 - Plot 56 - 60, Kampala, Central, 00256","","","https://www.freightnet.com/profile/156817.htm","No"
"A&k freight logistics","Nabugabo , Nakawa, KAMPALA, UGANDA, None","","","https://www.freightnet.com/profile/167060.htm","No"
"Chronicles Global Aviation Ltd","UMA show ground LUGOGO P. O. Box 21245 Entebbe Uganda   , Entebbe, Uganda, +256","","","https://www.freightnet.com/profile/161675.htm","No"
"ALIMANN LOGISTICS UGANDA LIMITED","PREMIER COMPLEX, NAKAWA ROAD , 1ST FLOOR ROOM 15, KAMPALA, UGANDA, 80100","","","https://www.freightnet.com/profile/144259.htm","No"
"Cargo Afrique Logistics","23, NEAR KIRA RD POLICE FOOT BALL PITCH, KENETH DALE LANE, KAMWOKYA, KAMPALA, NAKAWA DIVISION, NAKAWA DIVISION,KAMWOKYA , Kampala, Kampala, 28687","","","https://www.freightnet.com/profile/153025.htm","No"
"Jelani shipping Company","Bwetwajja House , Kampala, kampala, 1778","","","https://www.freightnet.com/profile/149443.htm","No"
"Dsv Air and Sea ltd","Plot 2490, Block 243, Luzira Commercial Park, Uganda , kampala, Kampala, 256","","","https://www.freightnet.com/profile/148575.htm","No"
"PDOF Uganda Limited","Kabalagala , Kampala, Makindye county, 73625","","","https://www.freightnet.com/profile/141632.htm","No"
"DSV Air And Sea LTD","Luzira Industrial park  , Kampala, Uganda, 23600","","","https://www.freightnet.com/profile/139722.htm","No"
"EASTAFRICA MOVERS & LOGISTICS LTD","Serena Hotel Kampala  , Kampala, Kampala, +256","","","https://www.freightnet.com/profile/127499.htm","No"
"Klema Services Uganda Limited","Plot 3, Pilkington Road , NIC Building, Kampala, Kampala, 3984 Kampala","","","https://www.freightnet.com/profile/110946.htm","No"
"Cipro Freight","ACORD House, Nsambya , Nsambya, Kampala, P.O Box 71919","","","https://www.freightnet.com/profile/101515.htm","No"
"Three Ways Shipping Ltd","P.O.Box 12028 , Plot 87 Jinja Road, Kampala, Kyadondo,","","","https://www.freightnet.com/profile/1858.htm","No"
"mittglobal","Plot 10 Bombo road Kampala Uganda , Plot 10 Bombo road Kampala Uganda, kampala, Uganda, 256","","","https://www.freightnet.com/profile/121033.htm","No"
"Fast Global Logistics","Mubs Raise , Nakawa, Kampala, Uganda, 256","","","https://www.freightnet.com/profile/119103.htm","No"
"RAYMARK INVESTMENTS LTD","MM Plaza, Plot 4 Luwum Street 4th floor R25 , KAMPALA, UGANDA, +256","","","https://www.freightnet.com/profile/65402.htm","No"
"GLANCE UGANDA + LOGISTICA","NTINDA ROAD  , P.O.BOX 556, KAMPALA, KAMPALA, 256","","","https://www.freightnet.com/profile/99315.htm","No"
"TOGETHER AS ONE ENTERPRISES LTD","SUITE 43 CARGO TERMINAL  ENTEBBE INTERNATIONAL AIRPOT , ENTEBBE, ENTEBBE MUNICIPALITY, 256","","","https://www.freightnet.com/profile/90232.htm","No"
"TOGETHER AS ONE ENTERPRISES LTD","SUITE 43 CARGO TERMINAL  ENTEBBE INTERNATIONAL AIRPOT , ENTEBBE, UGANDA, 256","","","https://www.freightnet.com/profile/94964.htm","No"
"Eastaf Cargo Ltd","P.O. Box 3130 , Mombasa,","","","https://www.freightnet.com/profile/6241.htm","No"
"SAFI Uganda Ltd","P. O. Box 21144 , Kampala,","","","https://www.freightnet.com/profile/12060.htm","No"
"Expolanka Freight (Uganda) Limited","2nd Floor, Plot 2, Jumbo Plaza , Parliament Avenue, Kampala,","","","https://www.freightnet.com/profile/13969.htm","No"
"ECU WORLDWIDE UGANDA LIMITED","NAKAWA BUSINESS PARK , BLOCK B, 3RD FLOOR, KAMPALA, UGANDA, 10318","","","https://www.freightnet.com/profile/252463.htm","No"