"name","address","phone","website","profileUrl","isPremiumMember"
"AA Appointments","St Clare House , 30-33 Minories, London, EC3N 1PQ","","","https://www.freightnet.com/profile/8997.htm","No"
"People's Need Consultants","38 Belgrave Road , Walthamstow, London, E17 8QE","","","https://www.freightnet.com/profile/5450.htm","No"
"Alchemy Recruitment","Essex House , The Street, Latchingdon, Essex, CM3 6JP","","","https://www.freightnet.com/profile/8998.htm","No"
"Citygate Personnel Ltd","Summit House, 13a High Street , Wanstead, London, E11 2AA","","","https://www.freightnet.com/profile/8999.htm","No"
"Freight Personnel","Suites 130/131, The Business Design Centre , 52 Upper Street Islington, London, N10 1QH","","","https://www.freightnet.com/profile/9002.htm","No"
"RPC Search and Selection","164a High Street , Southampton, Hampshire, S014 2BT","","","https://www.freightnet.com/profile/9472.htm","No"
"Stream (UK) Ltd","Trocoll House , Wakering Road, Barking, Essex, IG11 8PD","","","https://www.freightnet.com/profile/9789.htm","No"
"Ambassador Recruitment","Meridain House, Road One , Winsford Industrial Estate, Winsford, Cheshire, CW7 3QG","","","https://www.freightnet.com/profile/9811.htm","No"
"m2r Ltd","Evans House , Monckton Rd, Wakefield, Yorkshire, WF2 7AS","","","https://www.freightnet.com/profile/10527.htm","No"
"Woodman Scott","St Marys Court , The Broadway, Amersham, Buckinghamshire, HP7 0UT","","","https://www.freightnet.com/profile/11350.htm","No"
"Oceanic Resources International","Ground Floor, Bridgefoot House , Star Street, Ware, Hertfordshire, SG12 7AA","","","https://www.freightnet.com/profile/14451.htm","No"
"Ragged Edge Consulting Limited","1-3 Dudley Street , Grimsby, Lincolnshire, DN31 2AW","","","https://www.freightnet.com/profile/18718.htm","No"
"Freight Solutions","2430 The Quadrant , Aztec West, Bristol, BS32 4AQ","","","https://www.freightnet.com/profile/20451.htm","No"
"Fenwick Consulting Ltd","5 Nungate Gardens , Haddington, East Lothian, EH41 4EE","","","https://www.freightnet.com/profile/22816.htm","No"
"Drivers on Demand","6 Steele Road , Park Royal, London, NW10 7AR","","","https://www.freightnet.com/profile/52173.htm","No"