"name","address","phone","website","profileUrl","isPremiumMember"
"Ocean Logistic Services","Calle Las Flores, Edificio Puppo, PB local 02 , Puerto La Cruz, Anzoategui, 6023","","","https://www.freightnet.com/profile/260824.htm","No"
"KIA SHIP PROVIDER & MARITIME SERVICES C.A.","PUERTO CABELLO  , PUERTO CABELLO, PUERTO CABELLO / VENEZUELA, 2050","","","https://www.freightnet.com/profile/198563.htm","No"
"Kia Ship Provider & Maritime Services C.A.","Puerto Cabello , Puerto Cabello, Carabobo, 2050","","","https://www.freightnet.com/profile/198618.htm","No"
"VENEZUELA MARITIME SERVICES, C.A.","AVENIDA 5 DE JULIO, C.C. 5 DE JULIO, LOCAL M5 , PUERTO LA CRUZ, VENEZUELA, 6023","","","https://www.freightnet.com/profile/184771.htm","No"
"MARINE NETWORK ENTERPRISES, CA","TORRE EMPRESARIAL SALON FRENTE A PLAZA SALON ENTRE CALLE COMERCIO Y COLON CASCO HISTORICO , PUERTO CABELLO, VENEZUELA, 2050","","","https://www.freightnet.com/profile/145950.htm","No"
"Venesurco Shipchandler","Zona Colonial, Calle Ricaurte, Edificio 1-57, Oficina 08 , Puerto Cabello, Carabobo, 2050","","","https://www.freightnet.com/profile/111671.htm","No"
"ShipService Venezuela S.A.","Avenue 69 street 82 , Maracaibo Port, Maracaibo, venezuela, 4005","","","https://www.freightnet.com/profile/57726.htm","No"
"Beyond Marine Services, C. A.","Urbanización Cumboto Sur, C. C. Pareca , Oficina 2 - 02, Puerto Cabello, Carabobo, N/A","","","https://www.freightnet.com/profile/51202.htm","No"