"name","address","phone","website","profileUrl","isPremiumMember"
"ACUMEN FREIGHT","2291 Alexandra Drive, Hatfield , Harare, Zimbabwe, n/a","","","https://www.freightnet.com/profile/196223.htm","No"
"Freight Cargo Handlers","Aviation Ground Services Complex , New Cargo Village, Harare, Zimbabwe, ZW0001","","","https://www.freightnet.com/profile/236181.htm","No"
"VELOGIX FREIGHT INTERNATIONAL","AGS Complex, Robert Mugabe Airport, Harare , 23 St Marlo, Greendale, Harare, Harare, Zimbabwe, CY0204","","","https://www.freightnet.com/profile/152805.htm","No"
"Affluent Freight (NVOCC)","AGS Complex , New Cargo Village, Harare, Zimbabwe, AP120","","","https://www.freightnet.com/profile/169080.htm","No"
"freightquipservices","1718 section 5 kambuzuma harare , harare, zimbabwe, 263","","","https://www.freightnet.com/profile/116272.htm","No"
"Gladercom Freight","Old Wingflora Complex, Harare int. Airport. Harare , office 3 , living waters building, Beit Bridge, Harare, Zimbabwe, 263","","","https://www.freightnet.com/profile/101451.htm","No"
"Shipping Champions","P.O Box Ap172 , Ground Floor, Office No.2, Harare Airport, Harare, 00263","","","https://www.freightnet.com/profile/56024.htm","No"